Title,Date,User,Body,RatingMesmerizing,10/18/2017,ChuckieChubb,"Some of the best and thorough journalistic storytelling I been exposed to...maybe ever. I believe I’m hearing all sides. And it lets the listener draw my own conclusions. The series on cop shootings really make you contemplate all points of view. I hope Trump series continues to develop as well. The production is so GOOD, it’s transparent. Bravo.",5
Great Series,10/18/2017,Coffee Admirer,This series is very well put together!! Topics couldn’t be more relevant.,5
Love your style of reporting,10/18/2017,Consistently unimpressed,Thanks for keeping us involved in hard to gain perspectives.,5
Very interesting,10/19/2017,LVVED,Unique approach to analyze the current president’s track record and those around him.,5
A New Favorite Podcast,10/19/2017,AllisonBelle,"I discovered this podcast two days ago at work and I’ve already listened to every episode. Thoroughly interesting and addicting, can’t wait for more!",5
Good reporting,10/19/2017,foctrot2,Tends to lean to far in one political direction. I would wish they could be less biased as they are great reporters and story tellers.,3
Explicit Language,10/19/2017,Angus1526,5 f-bombs in like 5 seconds during the Steve Bannon episode. Poor taste.,1
Fabulous,10/19/2017,Goldenhar,Kelly- You and your team are the best! Thank you,5
This is what I want from news,10/19/2017,Lauryn96,In depth reporting and hearing from all sides of the story. Embedded leaves me eager for the next episode.,5
Awesome but open ended,10/19/2017,Stahl1911,"Loving the podcast and learning a ton. But just listened to the ""arctic"" episode on suicide in Greenland. Got through the whole thing and there was no ""why"". They dug into the story, but offered no closure or real value-added analysis. Found myself just really curious why suicide rates in Greenland are so high, without any real closure. Not sure if that's just the nature of the show or what. Just found myself with a bunch of new questions.",3
Oh yea,10/19/2017,tease tees tis tese teas tise teese,Love love love this show! You guys are killing it👊🏼,5
"Love, love, love this podcast",10/20/2017,Neknec,I have binge listened and have thoroughly enjoyed every single episode. I am thrilled to have found this podcast.,5
Lost vision,10/20/2017,Joe1133727,Should change title to Late Reporting,2
Wasted a Great Concept and Lost Credibility,10/20/2017,King Richard the Lionheart,"The first season is very good. It provided in-depth, unique, and necessary reporting. The second season, about Trump, is superficial and ordinary. It’s the same topic as the rest of NPR, with less insight. Don’t waste your time.",1
So good!,10/20/2017,BigSis2894,This podcast is amazing. I highly recommend.,3
Always great and interesting,10/21/2017,Ashley R-M,This podcast is always intriguing and educates me on issues I may not otherwise pay attention to.,5
Amazing podcast!,10/21/2017,Anon-y-mouse,One of my favorites,5
Kelly’s “voice fry” is unbearable,10/12/2017,danielari,"Great reporting but Kelly’s voice fry is unbearably distracting. No doubt female reporters are too often subjected to unfair critique and bias. However, if a male reporter utilized this speaking style I would 100% feel the same way. I just don’t understand why she chooses to speak this way, particularly at the end of almost every single sentence, but it is unbearable.",1
Excellent journalism,10/12/2017,spit bucket in seths corner,Interesting informative and well crafted.,5
Love the new shows on Trump!,10/12/2017,Not feeling creative,Great storytelling and I look forward to new episodes! I can’t get enough!,5
Thank you,10/12/2017,buckinbo,"Why do only people who understand this President is a bully listen, this is so Mr. President! I saw it long before he was elected. He I a bully who uses anything to get his way, the flag example is right on. Can’t wait for more.",5
Trump Stories,10/12/2017,SuddenSal,Thanks for this excellent investigative reporting. I wish more people could have heard stories like these before the election. Maybe they would have made a different choice. Sadly too many in this country spend their time watching reality tv shows like the Apprentice rather than listening or watching informative shows on PBS and NPR.,5
Sadly biased...,10/12/2017,arihp,First season was good. Second season is a joke. Not sure why I still listen to it... Probably not for long.,2
Another great show!!,10/12/2017,Beargrissly,Insightful,5
Oh my goodness,10/12/2017,sarahjanelooney333,Wow. I have been listening to podcasts endlessly for years. THIS is the podcast of podcasts. I have not heard anything that compares. Well done!,5
Nah,10/14/2017,Leo72881,"All these 5 star ratings are from before this $&@? aired. Like, what?",1
So compelling,10/14/2017,CCS 3060,This is great work. Interesting stories told really well.,5
Trump,10/14/2017,insane from barking dog,"Geez, what a loser. Thanks, enjoyed hearing the down and dirty. Great job.",5
One episode. Hooked.,10/14/2017,Awkward Mom,In depth and compassionate and informative.,5
The Golf Course,10/15/2017,mltaos,"I have a knot in my stomach after listening. Knowing how well you Research and fact check it is even more disturbing than ever to think of how lawless he is, his lack of regard for anyone or anything. He is our Berlisconi. Can our democracy survive even a couple of years with this man?",5
Yawn,10/16/2017,NewportBeachGirl,"More of the same old “Trump This; Trump That” dibble. Just as Hollywood can only crank out Superhero Movies and remakes, so too the media regurgitates the same old stories.",1
"Fantastic stories, so well told",10/16/2017,Mushy3211,"Smart and sharp stories are valuable in themselves. When they are delivered in the endlessly fascinating voice and style of Kelly McEvers, they are priceless. Great podcast!",5
A-Must-Hear!!,10/16/2017,Zincoxide,Can’t wait for more. Excellent narrative and affirms sense of insanity that we are now experiencing on daily basis from DJT.,5
You're 2 years late,10/16/2017,Pat8285,"Very disappointed that this season features ANOTHER in depth look at Trump. This is at least a year late and maybe two. Your time would have been better spent looking into opioids, Syria, Israel/Palestine, North Korea, the NRA...",3
Well Done,10/16/2017,35mm Films,"First exposure to a couple of episodes in October 2017 and found the topics timely and insightful. I'm a fan. While enjoying NPR's flare for superior production value, the candor, reference sources and fair-minded consideration combine to deliver a much higher than average reporting platform. Looking forward to more equally elevating stories. Well done, kids. Well done.",4
For liberals only?,10/17/2017,:-)joe(-:,If you want anyone to be evil it’s easy to paint them in that light. Objective editorials would let their listeners make up their own minds. This tries to persuade the listener towards the authors views. Very disappointing.,3
Good start on Trump,10/17/2017,x3steffi22,The first two episodes are well done. I wanted the man who was talking about the bad things Trump said behind the scenes at The Apprentice to be a lot more specific. I guess that part got cut out of this segment. For future segments I am looking for a discussion of money laundering done by Trump as detailed in The NY Times. It's sure to be one hot topic for the Mueller investigation but I'm sure you can tell the story more effectively for us non-lawyers.,5
So Good!,09/13/2017,MuBear!,Please give us more episodes this show was my first and favorite introduction to NPR.,5
"Fantastic investigative approach, super engaging",09/17/2017,DesertEagle77,"Embedded is one of the best podcasts I've ever listened to. The police series and the biker series are some of my favorite, I've listened to multiple times. Only complaint is that Kelly has taken a hiatus temporarily.",5
Used to love this podcast,09/18/2017,Casterlistener,"I loved listening to this podcast. Every episode was a new and interesting insight. Now? Well now they are just going political. It's a shame. They were good. So if you wanted to listen to something that was interesting and was something you don't hear everyday I wouldn't listen to this. It's just bandwagoning, muckraking yellow journalism. If that's your thing. Have a ball. As for me I'm done with them. Also I'm not a Trump fan. I'm just sick of it all",1
Great show!,10/01/2017,Queen Lory,Do not miss this show,5
Taking a pass on season 3,10/05/2017,S-dub_78,I’ve enjoyed this podcast in the past but I can’t stomach a full season delving into the past of our commander in chief. I chose not to watch his game show then and now I’m choosing not to hear about it now. Hope to pick this up again once this season is over.,3
Why Trump?,10/05/2017,Mile1,"This was a great show, until it followed every other tv show, podcast, and other outlet down the easy path of “Trump” journalism.",2
Can't get enough!!,10/05/2017,ValdezMarissa2018,I've been subscribed so I was pleasantly surprised when I heard Embedded come on this morning. I didn't want it to end!! I can't wait for the next episode!,5
Here we go again...,10/05/2017,Zeestella,"For like the millionth time this year. Is the “Left” not tired of always covering Donald Trump and how terrible he is? Embedded has hardly ever actually “embedded” themselves in any topic they covered save for the few. I’ve been listening since the beginning, but this “left-wing” person done now. I’ll stick with the non political stuff NPR puts out if they can manage that.",1
Unsubscribed,10/06/2017,Bert Humperdinck,Of all the topics to cover in the new season they choose Trump?! As if we don’t hear enough about this man. I’ll pass on NPR’s nuanced coverage of the soulless piece of garbage that is the US president.,1
Very informative and interesting,10/06/2017,SamiaP,"Love the show- I keep wishing more of this information came out before the election, but I'm glad Kelly is digging into this now.",5
Another Trump-bashing podcast…,10/07/2017,GGGirl29,"How original, another Trump-bashing podcast. It’s disappointing, even if it is expected at this point. I’ve been a subscriber of Embedded since the first episode and I’m sure I’m not the only one they’ll lose. Sad thing is that I’m not even a Trump fan, just sick of listening to the 24/7 hate that apparently passes for “news” in America now.",1
Poor Narration,10/07/2017,Verified,"I was eager to hear the recent story about Trump/Apprentice. Sadly I had to stop it after a few minutes due to the exceedingly annoying Valley Girl, growly, tone of the narrator. It overpowered anything she had to say that might have been of interest.",1
Just a liberal bias hit piece,10/09/2017,Magoobee,"I have no problem with hit pieces but to think that just Republicans are bad, is just plain naive, stupid and actually corrupt. 8 years of Obama's incompetence & corruption and the media just looks away and even worse, praises him. The job of a free press is to keep EVERYONE in power honest, not just the ones you don't like. Your suppose to be Journalist not Activists.",1
"Expedient Topics, Expertly Crafted, Gem of a Pod",10/09/2017,Avre’Affee,"McEvers and crew have put together a great podcast! The topics are relevant and intriging. There is a personal and resepctful nature to how the subjects are treated. This is what journalism is supposed to be and do. Thank you for making this happen, NPR.",5
Listener from the Beginning,10/11/2017,Suz7284,"I've listened to ""Embedded"" since the beginning. I have loved the podcast and recommended to several friends. I'm excited for this new season, but want to make sure all listeners are aware that this is not just pure journalism. It seems to be a liberal leaning (let's be honest, more than leaning) propaganda podcast. I'll still listen, but I also smart enough to recognize your agenda, Kelly:)",2
Love the in depth reporting,10/12/2017,Nancygr00,Starting strong with a fantastic new season of smart and thoughtful reporting.,5
Trump bashing,10/12/2017,Monte love,"Obviously no regard for the half of this country that support our president.
I would love to hear the same stories about the Clintons. However, I highly doubt that would ever be done",1
Kelly McEvers is crazy!,10/12/2017,Mike Rabe,Very in depth and fantastic reporting by Kelly McEvers. She goes to so many crazy places and gets the inside scoop. Very interesting content. A must listen. I must say the new season is a much different tone and less daring but still interesting.,5
Great deep dive!,10/12/2017,Knikatknight,Well researched and delivered. Thank you for the great work and keep it up!,5
Really enjoy it.,10/12/2017,E_DeJager,"I like the pace of this podcast. It tells stories thoughtfully, but it’s definitely compelling and I’m eager to hear more.",5
Police,05/02/2017,Stauffje,"Police cast was great report on all criminal justice theory. Theory is great, in theory it should work. People have different understandings of theory and interpret it how they want. Leads to differences in police discretion. Like that in every unit.",4
Amazing Reporting,05/08/2017,Drmpro8,"This podcast is for anyone looking for captivating and in-depth reporting. It focuses on interviews, on the spot accounts of what's happening, and a review of evidence to get the most comprehensive account of the stories they cover. It's absolutely one of the best podcasts I've come across.",5
Wonderful Find,05/16/2017,Wedevag,Three episodes in and I'm addicted. If you're a fan of Sword and Scale you will love this.,5
Incredible show!,05/17/2017,AleeFairOh,This is an amazing podcast. Highly recommend!,5
Really important and interesting!,05/30/2017,Nawlins7777,Love this podcast! Learned so much from it and can't wait for more! In depth journalism like this is such a blessing right now. They spend a months researching and developing a story to give us a 40 min episode. I hope they get to keep making these because this is the kind of journalism that informs and breaks down the idea that news must be quick and click bait-y. Thanks for all the hard work!,5
More please!,06/01/2017,Sarasmiles66,"Keep them coming, these are great!",5
Great podcast!,06/14/2017,LesleighWag,From the moment the theme music starts playing I'm hooked. I just wish there were more episodes!,4
Pushes the envelope,06/23/2017,Khglynn,Both in their reporting and their tech. I love the texting feature from the last episode. Very cool! Keep it up embedded team!,5
Amazing,06/27/2017,Eurythmicskkllmmnnii,"I love this podcast- thoughtful, humanizing, and easy to follow. Like watching a vice documentary-- Kelly McEvers maintains all the depth and humanity that video could.",5
Journalism at Its Best,07/13/2017,Lmwf,Keep up the good work!,5
When do we get more,07/18/2017,tim waiting,Waiting on more. Embedded started off like gang busters. Now so long a wait for more. Kelly when is next story,5
What news should be,07/29/2017,consumerjdz,"I'm not a review guy, but more people should be listening to this. Sorry for the paucity of the review, time constraints, just wanted to get my 5-stars on record.",5
Don't Miss It,08/08/2017,easygoing_surf,Riveting reporting!,5
Deep dives into important stories,08/24/2017,tarheelmommy,I've really learned a lot about topics that aren't part of my everyday life but that are really important.,5
Fantastic,08/24/2017,Seasyrah,Great stories. Wonderful narrator - easy to listen to! Thanks for all the great investigations.,5
New podcast obsession!,08/24/2017,Penguinigurl,"After listening to the first episode, I was hooked on this podcast. And after listening to about 8 more in the last week, I still can't get enough. The content is heavy, but if you're like me and love to learn about things that are important, you will enjoy the podcast. Highly recommend!",5
This American Life on reality steroids,09/06/2017,KASPDX,"Actually, earlier episodes could be called This Non-American Life. I just discovered this series and listened to every episode in one day. You need to be a bit of a dark-side-of-humanity junky but it's painfully good. I've seen some of the negative reviews and find them both valid and overly harsh. It's not a ""good news"" show and delves into and maybe dwells upon some of our most intractable societal problems. But the reporting is good--painfully so. While it does approach macabre voyeurism, it's necessary to approach that line in order to get an in depth look at unpleasant issues like drug abuse, motorcycle gang wars, challenges of race and policing, suicide, practicing medicine in war zones, etc. I'm glad that there are reporters that do this kind of reporting, but God knows why they subject themselves to it. It makes me worry for their mental health a bit. But, each and every episode has informed and sometimes altered my own perspective. That's what is great about NPR and this is another great example of that.",4
The best podcast from NPR,09/06/2017,Omar6488,They make every story interesting even when you think the topic wouldn't interest you. It feels like your watching a documentary in your mind. Can't wait for the next season of Embedded.,5
"Not really ""Embedded""",09/08/2017,Vintage Misha,"To ended oneself is to affix or attach themselves and so in this podcast there are a few stories that this does happen, 'The Bikers' and 'The House' while 'The Artic' came close but the producers messed it up. The rest of the podcast comes off as more in depth subject specific and often times speculation based special reports, not podcasts. I wanted, based on the podcast title and description, wanted that raw and gritty embedded non biased storytelling as opposed to the new story based on big headlines... this could be great but right now it is simple mediocre. Additionally, I far prefer Tom Dreisbach over Kelly... not sure why.",2
Come back!,09/11/2017,AP from CA,Perhaps my favorite podcast. Absolutely excellent reporting and extraordinary story telling. I miss you guys. When are you coming back??,5
So...white people are just evil? And cops are murderers?,03/29/2017,Dirtydwg,"This is nothing but elite upper class university children talking about things they don't fully understand...Flagstaff was a disgusting episode. A cop shot a man and had to kill him and they want to blame the cop for protecting himself and his community. Perfect way to start the podcast is ""we dive into these police shootings, normally and unarmed BLACK MAN"" this is propaganda against white males and your looking for race issues that in MOST cases isn't even there!",1
Consistently interesting and thorough podcast,03/30/2017,cjmorrissey,"These stories are extremely interesting. Kelly is a delight to listen to. You can tell a lot of thought, time and research goes into each episode on the part of everyone involved. I'm fairly new to podcasts but this is the best I've come across so far.",5
Good perspective,04/01/2017,The sam stet,It's amazing entertainment which I enjoyed.,5
A bit bleak but great reporting,04/04/2017,Smellulata,"Love the show! The series about police shooting videos was weighing on me, but the last 2 episodes were great and offered interesting different perspectives on the entire issue. Highly recommend!",5
Excellent,04/05/2017,Connor90254,This is my new must-listen (sorry Radio lab.) I love this show. The topics are interesting. The concept of going deep into a story is awesome. And Kelly is a great host. 5 stars.,5
amazing investigative reporting,04/06/2017,Not great and too many ads,"I held off on listening to this one as I've been on podcast overload, but I'm so glad I finally listened. Loved the first set of stories and binged on all of them. Keep it up!",5
Riveting,04/07/2017,kdo42,It's nice to be able to hear the full story of what's going on.,5
BEST,04/10/2017,Lalalalali1296,"I listened to every podcast in less than a week. I really appreciate the 360 degree insight on really complex topics/questions. I would appreciate more coverage on controversial topics, like refugees and human trafficking",5
"Brilliant coverage, quality production",04/12/2017,LorenzoJones,"Kelly and Tom (and other occasional correspondents) do a wonderful job painting the picture for their story. The stories are not too long or short and completely captivate me. If I can't watch documentaries at work, this is the next best thing.",5
Amazing podcast,04/12/2017,Swanbug,I love the reporter of this podcast and the stories they cover. Keep up the amazing work!!,5
Love this podcast,04/13/2017,Anna Negrete,"I love this podcast and the variety of topics and ideas it presents. There's no opinions or one side verses the other, just pure truth and experiences",5
Excellent,04/13/2017,Bansley7109,This has quickly become one of my favorite podcasts. I am obsessed.,5
True Fair and Balanced reporting,04/15/2017,Matheson Harris,This latest season has shown me what fair and balanced really can be. Kelly gets at every angle of an issue. Top-notch.,5
thanks,04/22/2017,donnaisobel,for the show,5
Very informative,04/26/2017,Camila216,"Very informative, research well done. The host does a great job.",5
Can't stop listening!,04/27/2017,Cyfdgu,Engaging!,5
I'm Hooked,04/27/2017,AuLu,"This has quickly become one of my favorites & I appreciate the length of the episodes-mostly short enough to finish in a single commute, but also so good I am often left wanting more. Great narration & subject matter. Please keep it coming!",5
Excellent podcast!!,04/29/2017,Cipps76,"I love this podcast. My only complaint would be I wish it were longer. Anything I've heard from npr is really good and this continues that. Great, great job to all who create this show. I Look forward to more episodes",5
Voice,04/30/2017,Britannia 13,Giving real people a voice. Important issues that are getting pushed aside in the media by the distractions of the current administration. Thank you!,5
Love,05/01/2017,Timmayxyz,I heard about this podcast from Livewire Radio one Saturday on NPR. Decided to look it up and now I'm hooked. I love that Kelly actually looks deeper into the story than the usual 30-second headline most news companies settle with. This doesn't answer all the questions but fulfills my insatiable appetite for more information on those headlines.,5
One of the best!,03/16/2017,kadoodie,Great insight. I always enjoy listening even through the episodes about difficult topics. I'm grateful you that I'm able to to listen to this podcast!,5
Thank you!,03/16/2017,Jcaesar81,I've loved it so far.,5
Wake up,03/17/2017,Falooiin,"With the overwhelming amount of awfulness that is happening around the world, it is so easy to feel desensitized. Embedded awakens the soul! Each episode captures the essence of the people and the environment. The audio is raw and real.",5
Never a bad story!,03/19/2017,Flex.Long,I devour each podcast as soon as it is released. Never a bad story! Thanks for the hard work that goes into everyone of your stories.,5
Exceptional,03/19/2017,einah pets,"Riveting, great reporting.",5
One of my favorites,03/21/2017,HelenH91,I recommend my podcast listening friends to give this one a go. Wonderful show you have here. Keep up the good work.,5
My favorite podcast hands down,03/21/2017,Alan in Seattle,"Terrific reporting, crisp production - plus you get to listen to Kelly McEvers for about an hour straight - what more could you want?",5
Bikers,03/21/2017,Cac4000,I just listened to this episode. So different than the regular stories you hear on the news. Please keep them coming!,4
Did it again,03/21/2017,KaylaJay29,"Really interesting look at police videos and the stories behind them. Perspectives that hopefully we can all learn from. Kelly McEvers and the NPR team are doing well on this one, up there with the great work from season one.",5
Manipulative,03/22/2017,Chaz Devine,"First season was good, second season has been, so far, biased and manipulative with information",1
Exceptional podcast,03/22/2017,JaysonMontgomery,"Today, I played first episode of this podcast on my stereo for background noise while I cleaned the house. Halfway through the first episode, I grabbed my headphones to listen more closely. Hours later, I had listened to every episode and cleaned way more of my house than I intended to clean.",5
Intense,03/24/2017,Small Town Boy,"Intense, insightful and not for the faint of heart.",5
Pretty good,03/24/2017,EmilyHouston,I've enjoyed this so far. It's a variety of stories about a variety of people.,4
Thought provoking,03/26/2017,23dj,Excellent and interesting.,5
What an experience!,03/27/2017,Jellyfood,Honestly one of the most thought provoking and through podcasts I've ever listened too. A large range of topics for a pretty young podcast.,5
NPR usual,03/28/2017,yentle the nimble,Super interesting. Easy to listen to. Thought provoking.,5
The best,03/28/2017,Jedifizer,Love this so much. Please make more! This is by far my favorite podcast right now.,5
Heartfelt,03/28/2017,Am2529,Love it! Difficult and hard topics. Educational and insightful.,5
Great Stories!,03/28/2017,Star girl727,"Great reporting, digging deeper in stories that pull at your heartstrings. I can't stop listening. My car ride to work is never quite long enough.",5
Gripping Stories,03/29/2017,eRobyn,"Why lie? When I found out this season was going to be about police shootings, I almost unsubscribed. But I gave it a chance and the stories are amazing, high quality, well produced. I don't expect less from NPR, but this podcast really goes above and beyond.",5
Love,03/01/2017,kylefox101,"Great in-depth reporting, very interesting topics and an incredible host. Please continue the amazing journalism!",5
