Title,Date,User,Body,RatingIt's actually good,07/13/2016,Awww shucky ducky!,"I'm a huge gene demby fan from his podcast post bougie. So when this rolled out I thought it was gonna be good. I really enjoyed the discussion on Ali, it's been absolutely great since then.",5
Well worth the listen,07/14/2016,Ken_Yeezy,Subscribe!!,5
Great podcast,07/14/2016,Smw13!!,Eye opening podcast. I've loved the blog for a long time. The podcast goes even deeper.,5
Excellent.,07/14/2016,fendstat,"""Black and Blue"" presents the unique insights of black police officers into black-police interactions.
On the lighter side, ""Made For You And Me"" explores the relationships between various people of color and the great outdoors.",5
2 stars because it's NPR & well produced,07/14/2016,Ehodges05,"otherwise, the marketing for this podcast is totally misleading..It's basically like NPR made a podcast to show white people what it's like to have every race represented except your own, delivering content & opinions from their personal views/perspective on what you think, believe or do. experts on white people & the bias and mishaps they cause.. This isn't a bad thing, I just think it's better to not mislead in the description & own it. people will listen no matter what because it's an NPR podcast, but i just wanted to comment because while I don't disagree with the views represented, I think they had a platform to engage a broader audience & establish a more ""balanced"", realistic dialogue focused on making progress & missed that opportunity..",2
Something to Expand your Perspective,07/15/2016,HappyFutureGradStudent,"As a young white man who came from a very white household and had all white friends it was a shock when I first went to college and finally began to become close to people of lots of different races. By the end of school though my best friends were Indian and black, and my girlfriend was Hispanic. I learned so much in conversations with them that I never understood before. This podcast is another fantastic way to expand your perspective. It challenges me to think more about how I act and what I say and informs me more about aspects of race I never understood. Keep up the good work!",5
Thoroughly enjoyable,07/15/2016,Millie Lovers,I'm a huge fan of the show!!,5
Love it!,07/16/2016,Pod Blankie Cast,Was looking forward to a Code Switch podcast and it didn't disappoint!,5
Breath of fresh air,07/16/2016,Emmjayee,"This show is a breath of fresh air. Thank goodness NPR is putting out a show that challenges it's listeners to feel unsettled and to rethink their realities. Amazing to hear an all POC team, especially as a POC myself.",5
Insightful,07/16/2016,1nProgress,Refreshingly empathic journalism bringing thoughtful analysis with a dynamic and diversified team of young professionals. The Code Switch team approaches stories with a genuine curiosity of discovery and a collective fearlessness to deconstruct complex issues. Love it.,5
Awful!,07/16/2016,Whatisthisgarbage9999999977777,"This podcast is awful, racist garbage.",1
Love this podcast,07/17/2016,ggrove,I'm a white senior citizen and am learning sooo much! It's really opening my eyes to the inequality of our society.,5
"Great show, much needed, needs work",07/18/2016,Chin Kim,"I wish this were a regular NPR show instead of just a podcast. My guess is that older, white listeners would defund NPR if it were on the air.",3
The best!,07/20/2016,Annietheknitter,"Finally! I am so happy that this podcast finally exists! It is absolutely amazing, I can't recommend it enough.",5
Great addition to political podcast landscape,07/20/2016,Cmtlang,I love the point of view of this podcast. I have started looking forward to it every week. The episodes following the Philando Castile and Alton Sterling murders were especially healing and cathartic.,5
Interesting take on America,07/20/2016,DarthEvil7289,I wondered what kind of podcasts this would present and was pleasantly and surprisingly engaged by the show. I watched the one on OJ and the more recent podcast on Philando Castile which was a simple presentation of his history with police stops. Measured and thoughtful. sometimes challenging. Keep them coming.,5
Telling reviews on here,07/20/2016,peinkypanna,"It's great that this podcast started out with the whiteness episode because it came out strong with what we will see to come from this podcast. I enjoyed that episode and every episode afterwards. Constructive criticism: the direction of the show is confusing as each episode has a different staging from the prior. It needs to keep a somewhat consistent pattern, like popular NPR shows like Invisibilia, TAL, Planet Money, Hidden Brain, etc. Other then that, they talk about the issues that I want to know about, especially recent news which is informative but feeds the emotional need. Please don't let these haters on the reviews sway your opinion of this great podcast. They are just white people (maybe even just mentally) that haven't realized that not everyone is white - says a white millennial woman.",4
Interesting & varied,07/03/2016,KatieM&$6,I enjoy listening to podcasts where I am not the target audience. Podcasts that speak to life experiences I don't know and never will in a first person sense. It helps me better understand the world around me and gives important context to US events. This podcast is part of my effort to know more and I hope they continue to navigate what is a task.,5
White people might not like it but they should listen anyway.,07/03/2016,DougSarver,"As a white person, I have found this podcast interesting because it helps me to see how other parts of the country might be percieving me. I am a white male and I am better able to see my privledge with help from shows like this. I do wish the show also had a white voice to help give their perspecctive as well, though. Without that, the show feels less like an educational program and more like a protesting one. Let's find solutions together.",4
White People Are MAD,07/04/2016,Boomshala,And obviously missing the point.,5
Not Quite Their Yet,07/04/2016,Nita.B.Brown,"For me, this podcast is still trying to find its footing. Focus on those untold stories such as the one on Margaret Cho's breakout show for Asian Americans. As a black women, the similarity in experiences of seeing people like yourself, you forget that it exists for other races as well. Those or the type of stories that will help to unite listeners. OJ Made in America was a unique story as well, because of my age I didn't realize that he had manufactured his image in that manner. Thanks and I look forward to your continued growth and success.",3
Fly on the Wall,07/05/2016,Maestra Wilson,"I looked for this podcast a year before it came out and am delighted that it is finally here! I am a White non-Latino person who is eager to hear about the different perspectives that are part of our diverse American community. I have listened to all the episodes so far and don't feel that they are ""making White people feel bad"" (like another review said). I feel like I am a fly on a wall where really smart people of color are talking about current events and pop culture and mixing those current events with historical events and their personal experience. Keep up the good work!",5
Breath of Fresh Air,07/06/2016,leeleeg,"This podcast really is awesome and interesting and a window to perspectives you wouldn't normally get. I listen to a lot of shows but Code Switch along with NPR Politics are now my favorites. I don't understand the negative reviews. I'm white and would not get these kinds of insights without this show. Thanks, Code Switch.",5
Awesome podcast,07/07/2016,Good form,My fave,5
This is Fantastic Podcast,07/07/2016,jeffmasters1,"I love this podcast. They discuss race in interesting, insightful ways that I don't hear anywhere else.",5
White tears below,07/07/2016,Collectorofwhitetears,"So many white tears in the reviews below, I would need more than one swimming pool to fill all their tears with.",5
"Calm down, fellow white people...",07/07/2016,Philnick93,"...they aren't trying to attack you. I think this podcast is excellent because they deliver a thorough analysis of what it means to be white, leading to some interesting points. Please don't be so offended and just listen. Race needs to be discussed in order to tackle racism.",5
Excellent,07/08/2016,AppleIsACult,"These are exactly the kinds of conversations we need to be having. The 'whiteness' episode was particularly interesting. The backlash in the reviews here is to be expected, but maybe more conversations like these will chip away at the hate.",4
Nerve Struck! Keep it Coming.,07/08/2016,Pearlkabra,"Whoa, this show is pretty benign as far as what could be said about race in America.",5
Buzzwords galore,07/08/2016,Justin_ham,"I had a bad feeling about this show, but I decided to give it an open-minded try. After listening to two full episodes, I can say that it has confirmed all my suspicions. Diatribe & racial divisiveness all under the guise of progressivism -- big words but little substance. These types of issues/ideas ARE important to discuss, but NPR has entirely missed the mark here.",1
Just what I've been seeking,07/09/2016,Talimander,"I'm so glad CodeSwitch team finally have their own podcast. Particularly as a white person, I find the hosts and guests to be informative and balanced. Am I in agreement with everything said? No. Neither would I expect or want to be. I'm seeking something more--thoughtful insights, wit, new perspectives--and I'm finding that with these episodes.",4
Refreshing and Smart.,07/10/2016,jessica.d.oliveira,"I've become obsessed with this podcast, and can't stop talking about it with friends and coworkers. Thank you for the research you do, and the time you spend bringing up the concerns on the hearts and minds of people of color in radio. I look forward to future seasons and want you all to win!",5
Great Podcast,07/10/2016,LaurAlyBee,"I was so excited when I heard the buzz around this podcast on NPR. I was not disappointed. Great conversations! Interesting, informative, and unique.",5
Possible game changer,07/10/2016,l.Ellison,"It's taking a moment for this podcast to find its feet--understandably so, it only just began. A few episodes have had little to add to the conversation about race in the US, others have been interesting but still mostly regurgitating ideas that can be easily found elsewhere.",5
Just listen,07/10/2016,Reneegaudetdesigns,I am learning so much. Thank you all for your time and efforts to put forth this needed podcast.,5
"We are all colored, but does it matter?",07/11/2016,Young bob 37,"From what I know, every physical body has color regardless of race. Here are some questions I would like to ask the journalists of this podcast. Can you tell what are the different races of the human soul? And if we have souls and there is a creator as in God who created us, does God then identify us according to race? I say that if the creator sees me for who I am then why should I not see myself or others that way?",1
"Great show, doing important, difficult work.",07/11/2016,xtianrut,Code Switch is an intelligent and nuanced show about the often-difficult subject of race in America. The hosts and guests are consistently excellent. Great work all-around.,5
"Interesting, but...",06/26/2016,Dhregs,"It's a pretty good show, but some of the episodes, as well as little moments in each episode, just make me roll my eyes.",3
Whites don't like 🤔,06/26/2016,Topoftheworld1901,"Code switch coming to NPR is like 2015-16s baby- if that makes sense! The hosts are touching topics I think about, come across on the news perhaps, or deal with in my day to day.",5
So happy this conversation is happening,06/26/2016,Cguido28,"I am so happy that npr has something of their usual quality to add to the conversation about race. Amazing hosts, great blog transformed into a fabulous podcast. Ballsy and enlightening",5
Horribly racist,06/27/2016,JTaaa,"I'm sick of these ""discussions"" on race and ""whiteness"" that are one-sided. That's a lecture not a discussion. Don't tell me what I think-ask me what I think.",1
Racist,06/27/2016,Singram9988,"Very disappointed, this podcast is racist again whites people. A bunch of non white people talking about what it's like to be white. Saying non whites don't go to national parks, obviously you have never been to Yellowstone!!!",1
Meh,06/27/2016,Under20andlistening,"First I would like to start by saying the podcast has little content, and no storytelling. And while I enjoy their topic and feel they made some valid points they seem to focus solely on faults/differences of white people. Making it feel less of an attempt for racial equality, more like a rant or even dangerous propaganda.",2
What Public Radio Should Be,06/27/2016,bemob42,"Smart, well-produced conversations on important topics with great interviewees. I hope that some of the defensive one-star “we're post-racial, stop trying to make me feel guilty for being white” reviewers will stick with the show and see how much we can learn. Public radio should be educating the public for more informed civic engagement; this show is absolutely doing that. Thank you!",5
Poorly designed podcast,06/27/2016,Emi+nem,I tried really hard for awhile to listen to this podcast but I couldn't get into it,1
Awesome podcast,06/28/2016,Maddie r w,"People saying this is racist or giving it 1 star, you guys have a lot to unpack about racism obviously (as do we all). Maybe try to listen from the vantage that their points are valid, and see where that takes you. Smart and accessible. From, a podcast addict and white person.",5
Nonsense,06/29/2016,Landong,They know nothing of the real world. They fight racism by being racist (the non-white privilege).,1
Amazing,06/29/2016,Another person here,"I have been waiting for this for so long. White people who are sad and hurt, don't be. It's not designed to make you feel guilty. Race is just a reality for many of us. And we need space to think and discuss about it.",5
A lot of the reviews are why we need a podcast like this,06/29/2016,Laurita B.,The fact that so many people aren't comfortable listen to a podcast like this is exactly why you wanted to continue to do it. Thank you for bringing on multiple people to discuss their experiences in relation to personal history and current politics. I will continue to listen so that I stay open to other perspectives and experiences different from my own.,5
So necessary,06/29/2016,Jdmen,Thoughtfully considered topics and discussions. Really well done and important to our times.,5
"Thought provoking, hasn't quite found its voice.",06/29/2016,Teddyboyforever,"First of all, I like how many peoples button's this is pressing. That means they're on to something. Uncomfortable conversations are good. I don't know if they've quite hit they're stride, but it's early yet. And yes, people will get very wadded up over this stuff, big deal- keep going!",4
"Great start, don't mind the trolls.",06/30/2016,Cichor,"Actual listener here. I appreciate your approach with the first episode on whiteness. I first heard of the host on Another Round so I knew he would be great! Thank you for covering some Asian-American issues, I'd like more on the model minority myth. Especially since a lot of times AA like to keep their head down on issues of race and racism.",5
Interesting topics,07/01/2016,Lfreeman00,"Wow there is a lot of anger on here that is completely uncalled for. This podcast's discussion about whiteness was just that - a discussion. No white-people-bashing at all. But people's anger over this podcast is exactly what the hosts were talking about; It is hard to talk about the American white identity because people don't have the tools to do it. We as a country have never learned how. People either ignore it or get really defensive. Anyways, the podcast discusses interesting topics in a casual tone. I found that it sparked discussions in my own life...and, yes, it made me think about my own white identity...but I wasn't angry about it.",4
Rep sweats was on point,07/01/2016,Mel Nuni,"That episode was the type of topics I thought the podcast was going to be focused on, good one!",4
Reductive and tired examination,07/01/2016,Mechblue,The topic is interesting and the production quality is high but the content is weak. Simplistic views of large groups of people based on their skin color neither elucidates nor gives us a path forward to make the world a better place. If the call for social justice consists primarily of feeling guilty for being born with a certain color skin don't expect it to be answered by many.,2
Interesting cultural journalism,07/01/2016,westontt,"I see this more in the realm of an intelligent discussion about culture - and pop cultuer - with a focus on the ways we categorize ourselves and others. Still early to tell how this will endure. BTW, I'm a white guy and never felt targeted or unfairly represented in any of the episodes.",3
Doesn't finish well,07/02/2016,Sleevesmcfly,"At the time of this review, there are 6 episodes out and I've listened to them all. This podcast does s great job of raising questions, but falls short of answering them. However, I do think that this show is a step in the right direction for representing people of color on public radio.",4
White people are the worst.,06/19/2016,eandonova,"Are you white? Do you hate yourself? Are you perpetually apologizing for being born white? You should be. If you're not always apologizing for the great privilege of being born white, you're a horrible person. It is impossible to care about racism while white without feeling ashamed of the great shame of being born white. Never mind that you have absolutely no control over being born white. Apologize, you're an oppressor. Do NOT, whatever you do, say that a person of color talking about your whiteness might be wrong. You cannot talk about people of color, but you better be open to listening to their life stories. Ugh. Get out of here. Such dishonest discourse.",1
"Yes, please",06/19/2016,Pnwfan,"I have been waiting for this for years! A dedicated space for the amazing Code Switch team to explore race, culture, politics and the intersectionality of modern American life. Yes, whiteness should be discussed explicitly. Yes, as a young white lady, I needed to hear the different impact that Muhammad Ali had in communities of color. And yes, raising up queer voices of color is essential for understanding and healing after Orlando.",5
Promising but awkward,06/20/2016,Roachie D.,"Premise & reporters are good, but show doesn't seem to have its footing yet.

Also, a podcast about disenfranchised voices being sponsored by Air BnB seems a bit tone-deaf and super awkward to listen to, IMHO.",4
Awful waste of time.,06/20/2016,Khanal13,Awful show. They are trying to find racism or connection where there is not. They need to do their research right and come with an unbiased point of view,1
Amazing,06/21/2016,A friend like them,"I love how it discuses the
Origin of stereotypes because of the discussion of POC in The outdoors I was introduced to my all time favorite video the black hiker.",5
More crying,06/21/2016,Cloud father,From people who want everybody to share the exact same ideology,1
Oh god this podcast,06/21/2016,Youcandobetterbuzzfeed223,"Content from NPR has been getting worse for a few years now but this sets a new low. Code Switch examines race in America with with such a microscope that the podcast could be passed off as a parody of NPR. Was told it would make me laugh, and it would make me think critically about race. Didn't expect it go have me laugh at their critical thinking on race.",1
Good beginner conversations,06/22/2016,u3drive,"Race is uncomfortable to talk about. These discussions are respectful, approachable and give appropriate steps for action. The panel is diverse and so are the topics. It's not in depth on many topics, which I'm sure annoys people with more advanced understanding. But I would point people here for a good starting point for racial conversations. The basics are hard to get right and I think this podcast does an excellent job.",5
Loved it!,06/22/2016,Cedarhillmom,Great shows! Don't know what the others are talking about. But anyway. Awesome show from an African American married (18 years and counting) and mom of 4. Keep on...Keeping on...Awesome!,5
Very engaging,06/22/2016,Donquay,"Academic, yet relatable. I enjoy the frankness which the hosts dissects and investigates beliefs and ideas often taken for granted as fact",5
This is an important conversation...,06/23/2016,AMCinDMV,"and we need to listen. 30's white female here - with all of the nasty reviews on here from Caucasian people, I feel as though that information is relevant. Guess what - there is a lot of pervasive racism in this country that white people never even see. That doesn't mean it isn't real or isn't having an impact on people's lives - it means it's way past time to pay attention. I really enjoy this show - I'm learning a great deal in an approachable, conversational style. Keep it coming, Code Switch.",4
A Must Listen!,06/23/2016,Hannah_is_a_palindrome,"I never write reviews, but after reading through a bunch of negative ones felt compelled to urge everyone to listen to this podcast yourself before making a decision. As an academic, I think this podcast is extraordinarily well done: open-minded, constructive, thorough, and respectful. As a human being, I think this podcast adds an essential element to the contemporary conversation surrounding racial, ethnic, sexual, gendered, and religious equality and mutual understanding. The discourse of whiteness is a fascinating and complex one, and this podcast is a stimulating means of exhorting us to question our underlying assumptions and unconscious biases.",5
Reverse Racism is real.,06/23/2016,screenbetween,Don't be shamed because of the color of your skin.,1
Wow,06/23/2016,Obamination,I can sum the first episode up in one word... Garbage. Don't waste your time,1
buh-bye,06/23/2016,cb_abq,More whiney NPR victim culture here.,1
Love the perspective,06/23/2016,Junoescareme,"As a white woman, I really enjoy this podcast. It is really interesting for me to hear issues explored that sometimes I have never considered. Even when it is an issue I am aware of, I feel like I'm getting a view of the issue from the inside. I always enjoy learning about other people's experiences and perspectives, and I appreciate how that is done by Code Switch.",5
Should be removed from NPR,06/24/2016,5 Star Reporter,Title says it all.,1
Code Switch has Saved NPR from Itself,06/24/2016,Lilysea,"The earnest white liberalness of NPR getting you down? Codeswitch has saved the day. Smart, refreshingly honest, real talk about race and culture in US America. Thank you so much, Code Switch team. You are awesome in all the ways.",5
Good show!,06/24/2016,MikeRT10,"A nice weekly update on race in America while we wait for the return of Our National Conversation About Conversations About Race! I find the podcast informative as it draws my attention to things in the news and pop culture that I might have otherwise ignored or missed the nuances of. Well produced and engaging as I've come to expect from NPR,",5
Must listen!,06/25/2016,perspicaciousfox,"Thoughtful, interesting and sagacious dialogue on race in mainstream that has come at an optimal time. If you're white and want to peel back the layers of white priviledge, this is an excellent show for that. Insightful perspective by a smooth host. I just finished one episode and will eagerly devour more!",5
Thank you!,06/13/2016,sphe96,Thank you for creating a space for a different voice! Your podcasts are challenging ang thought provoking.,5
love code switch.,06/13/2016,kimbrlymay,"code switch is one of my favorite wings of npr. as a white teacher who has spent 15 years teaching at a super diverse school, I feel like they address issues I see every day that I never even knew existed growing up in upper class suburbia. I feel like a lot of issues they deal with are very real and it's great to see them not being ignored.",5
Imperfect but essential,06/13/2016,Mose__,"Anyone who dares to talk about race, identity politics, social issues, and the like had better be ready to hear a lot of criticisms, coherent and otherwise. For example, anyone laying claim to a fraction of a definition of blackness will catch flak from others for whom the experience of blackness (or whiteness/non-blackness) differs. Codeswitch dares to talk about these issues. No one's ever going to ""get it right"" because the words that comprise much of the subject refer to wildly different experiences among the listeners.",5
Happy to listen to it,06/14/2016,elshaman,"I am glad to hear this conversation going on. It is in our discomfort that we advance a discussion that has been LONG overdue. Race, racism, whiteness, Latinos, language, merit and privilege are things that as ethnic minorities and majorities we do not come to grips with in any meaningful way. I will say that I hope that they can refine their messages a little better but it's an important start and we should all be able to acknowledge that we are more ready to fall into our stereotypes and assumptions instead of constructive and difficult debates.",5
Interesting,06/14/2016,Funny & Addicting,I don't know why other reviews are being so harsh. I'm white and enjoy hearing from people of color about things I may not have otherwise thought about. It's a well produced podcast from NPR. I've really liked the 2 episodes I've heard so far. Great job!,5
