Title,Date,User,Body,RatingExcellent,03/23/2017,bnp120,"Inciteful, informative and the hosts are lovely. Dope, wide-ranging talk about race.",5
Enlightening,03/29/2017,morrison.278,I love this podcast. It's a chance to hear really smart and interesting people have enlightening conversations about race and culture every week. It can be surprising or moving or funny at any given moment.,5
SO GOOD,03/31/2017,SkunkhourOfficial,Quickly became one of my favorite podcasts. Great hosts and very easy to follow and digest.,5
simply fantastic,04/02/2017,sfredhead,"This is one of my favorite podcasts. I've learned about race, history, and pop culture. Bonus -- I knew about ""Moonlight"" and ""Get Out"" BEFORE the rest of the world did! And my appreciation for them was enhanced by this podcast. Keep up the great work!",5
Staying woke.,04/04/2017,Rblmel77,Thank you for your thoughts and important journalism.,5
YASSSSSS - educate yourself,04/12/2017,samwwwww,This show has really opened my eyes up to not only what the phrase code switch means but also to the many injustices and biases we face everyday in America. I love all the hosts and I constantly feel this show is relevant - especially with 45.,5
Give it a listen :),02/12/2017,Scce6,"Code Switch hosts uncomfortable conversation about race, ethnicity, community, and identity. I especially like when they have academic folks on to add to the conversation.",5
Great stuff,02/15/2017,mariepaix,I think they're having conversations that we need to hear -- especially these days. It's such a relief to know this podcast exists.,5
Great discussions,02/16/2017,EducatedBrother,Great discussions that give light to issues that impact communities of color. Love that it makes people uncomfortable- this disruption is needed for today's challenging narrative being written in our country.,5
Code Switch shines,02/17/2017,lucyelf137,"Code Switch is having important conversations that might not be happening on other platforms. The Code Switch team combines reporting with expert interviews and conversations with each other. As the podcast has progressed, it’s been a pleasure to follow Gene, Shereen, Cat and the rest of the team navigate various topics and what they want this podcast to be.",5
Indispensible in America,02/17/2017,ow1n,"I started listening to this at the end of 2016 because it was obvious everyone needs to have more empathy for everyone else, and some need to work on this more than others. If you've given this show a single star review chances are you're in the latter group. This show is friendly, fun, and informative.",5
I am so thankful for these conversations,02/20/2017,mp707,"This is the show I've been waiting for NPR to produce and now that it's here it is so much better than I thought it would be. NPR is often easy listening, and this is not. It's challenging, civil, and voicing perspectives that aren't readily heard. Constantly introspective, and with my own explanatory comma - This is because the editorial decisions appropriate for this show are not canonized. Euphemisms are outted. Keep up the hip hop interstitials - make me feel at home.",5
Absolutely Amazing,02/21/2017,Drickiss,"This podcast is amazing and leaves a lot to unpack. I look forward to Code Switch to get me through the work week. I admit that it's not for everyone and some people just won't get it. That's fine because for those of us that do, it's a breath of fresh air. Keep up the good work!",5
Sticking to the comfort zone- not good enough,02/21/2017,Petra46,"I was very hopeful about this podcast from the 1sode. Then...-It has become 'mainstream 'about race. The opportunity to open a real analytical, self-reflective conversation among races got lost pretty quickly. A white host voice is missing, for a round table on equality. ""whitness is elastic"" (from ep 1) so true, but elasticity is not among whites only. Where is your reflection on that? - (on Black Oscar ep) FACT is:Van Jones went on and interviewed AA that voted for 45. (so did latinos, and other ethnicities) were is the self reflection on race on these realities? - Again. You went mainstream. The issues are way more complex. You are sticking to your comfort zone.3 stars for effort. - P.W.",3
Informative and accessible!,02/21/2017,Lyss Brick,Awesomethey do this to allow people to listen to discussions of race that they might not partake in in their every day lives in the comfort of their earbuds. I have learned a lot from it and think the hosts are great.,4
Better yourself,02/22/2017,Msl5670,This podcast has made me a better person.,5
A Diaspora of Color Experiences,02/23/2017,jayarsmi,"I've come to truly see and understand the affect of white America on all people of color in this country through this podcast... it covers a spectrum of controversies and discrepancies that minorities face. Not only is it accurate, but encouraging to those who have experienced these situations. The majority who is not ""woke"" will not be able to appreciate. Listen if you want to learn about injustice and discrimination... do not listen if you want to be appeased.",5
See the World Differently,02/24/2017,CoastalSatyr,"I know, as a middle-aged gay white male, I may not be the target audience, but I am constantly fascinated by it. I feel at times, as a homosexual, I code switch at times myself, but surely not to the degrees this group of broadcasters has to. Get woke, America. Turn on the light as to what's around you with this great show!",5
thank you,02/26/2017,01027really,"i love this podcast, please keep up the great work",5
Highlight of each week,02/26/2017,DoodlesInHoboken,Each week brings a wonderfully nuanced and thoughtful discussion that challenges how I think and broadens my perspective,5
Explanatory Comma,03/02/2017,LifeInPhilly,Tupac is a legand who needs no introduction. Agreed. A good friend suggested that maybe an explanatory comma isn't necessary for one-name acts. Madonna. Beyoncé. RuPaul. Prince...,4
Code Switch,03/02/2017,Splashviola,"Code switch is an excellent show with smart commentary and a variety of perspectives. I love listening, and it keeps me on my toes. Keep up the great work!",5
I enjoy the Podcast (repeat),03/05/2017,Enjoy the Podcast,"I read some of the reviews (mistake #1)... For me, it's not worth the energy to explain why this podcast is necessary.",5
Keep up the great work!,03/05/2017,Egotrpn07,Just an excellent podcast!!! I'm always recommending it to my friends!!,5
Great Conversations and Guests,03/05/2017,Rebekah9876,"Love it, very well done",5
Especially relevant!,03/06/2017,GarlippKnot,Great podcast that brings up sometimes uncomfortable (as evidenced by the salty reviews) but necessary topics about race and class. My only complaint is that they don't upload their pods more frequently! Good stuff!,5
Love,01/09/2017,VMinnie,"By far my favorite podcast, and a helpful take on current events. Love you guys!",5
Good Work,01/11/2017,@scruggsreader,I am white have been married to a black man for 31 years and we have two grown daughters. Unforturnately most white people have no idea what it is like to navigate different worlds/cultures as people of color must do. Thank you so much for putting it out there and giving voice to those who do so. Hopefully more and more white people will open their eyes to these experiences and gain a better understanding.,5
Love it!,01/12/2017,calliecoker,"Love the show, just wish it was longer because I could listen for hours! ;)",5
Love it,01/12/2017,J_Leigh02,"Great, relevant podcast",5
Must-listen,01/12/2017,Aander98,"I recommend this podcast at any opportunity. The discourse covers timely, but everyday events. The hosts provide critical discussion with expert guests for respective topics.",5
Great Show,01/14/2017,MrDQJ,The vast array of voices heard on this show is impressive.,5
Worth listening!,01/15/2017,Inlovewithlife55,I love this podcast!,5
Tries so hard...,01/20/2017,"Andyroo184$,!2",Tries sooo hard to say something about tough topics that could be palatable to all but doesn't actually have the balls to say anything meaningful,1
A Good Place for Me to Listen.,01/23/2017,MKB_1983,"I'm a suburban white lady livin' the basic white lady life. This podcast is a good place for me to gather information I don't find anywhere else. Yes, I do a lot of Googling after the show to find out more about topics (or artists/activists/etc) they discuss, but I think that's good. I don't believe it should be spoon-fed to me.",4
The podcast everyone should listen to,01/26/2017,sandyliz79,"Code Switch is the best NPR can be. Each episode is well crafted, clearly the product of hard working journalists. And they keep a sense of humor even when covering the most serious topics, making it captivating and engaging.",5
Much needed insight,01/26/2017,CharlieMaggie4,"Thoughtful, good-humored insight into very important issues. So glad this podcast is available!",5
Excellent! About time!,01/28/2017,C Rattat,"One of the best podcasts to come out of NPR, ever... Thank you!! Don't change the format ever - always have this show be done by people of color, and keep it as candid and real as possible.",5
We need this podcast.,01/30/2017,Maddymaddymadmad,"Nobody else is doing this and it's so important. And the hosts are also incredibly talented and funny and basically everyone who works on this show is killing it. Thank you for teaching us white folks what the hell is happening, because race in American society is confusing and all the dialogue I hear around it among my white friends just sounds off. I need this and I'm so glad, so grateful I found this podcast. You all rock.",5
Smart,02/02/2017,ConnieT,Informative and entertaining.,5
Interesting and enjoyable,02/02/2017,thisisbeautiful,This podcast explores issues I want to know more about.,5
Unified Diverse Excellence,02/05/2017,Bgiggling,"I cannot get enough of this podcast! The voice swag of Gene and Shereen and their intellect, intuition and authenticity is soo relatable. This podcast is SUCH good journalism and a space that validates people of color and educates those who are not melanin-blessed. Thank y'all for the labor of love.",5
A gift of perspective,02/05/2017,Yay 4 podcasts,Loving the chance to be privy to conversations that most likely wouldn't happen if I was physically in the room. Keep 'em coming!,5
Love This Podcast,02/06/2017,BStrasters,Gene and Shereen go deep into racial issues and really make the listener think. It's great.,5
Love...Powerful,02/08/2017,ShellyDenise,I have to listen every week! Love this podcast. It is powerfu and insightful.,5
Love this podcast!,02/11/2017,Palmopher,I can't wait to listen to this show every time a new episode comes out! They do a great job of staying relevant and current with issues on race.,5
Top-notch!,11/26/2016,NBJ31346,"Episode and after episode, this podcast challenges and informs me. THe intercviews and discussions are intelligent, without being ponderous. This white woman appreciates your work.",5
Vsr20,11/27/2016,Vsr20,I love this podcast and constantly am sending episodes to friends and family. Love it and recommend it!,5
"Well done, I learn so much",12/02/2016,PenneyHen1010,Love the energy and tone and ideas and interviews,5
Code/Switch,12/06/2016,Pogonap,"This podcast grabbed my attention the first time I listened. I wanted to know more about what people of color where experiencing and thinking about and the first Code/SWitch podcast I heard was ""whiteness'. That was not the first motivator in my journey to support racial justice and equality, since I had previously read, with shock and disgust, that extreme racial injustice, for the most part, has merely changed its form since post civil war times. But this podcast adds a new level of understanding that increased my desire to learn more, participate and support those in the midst of this continuing and worsening crisis.",5
Informative / Amazing,12/08/2016,Nahyah,My favorite podcast so far. Intellectually stimulating and truly American.,5
Oh yes,12/09/2016,Moe Munny,Best podcast.,5
Worthy listen,12/10/2016,ojymak,"While not every episode is (I think) long enough or dives deep enough into the issues at hand - some are more like footnotes than full chapters - it's nevertheless been great to hear commentary from a specifically minority perspective. As a white woman, I don't necessarily even need them to go deep on everything - just hearing their non-white perspectives on bigger and smaller things alike - expands my own. I've learned so much just from listening to them.",4
Important Conversations from an Important Space,12/15/2016,Edprst,"Perhaps because it's an NPR podcast, I've seen feedback that criticizes Code Switch for making white people feel ""left out."" As a white person, I'm very frustrated when white people expect themselves to be centered in every conversation. I have never felt left out as a Code Switch listener. When topics come up that make me feel confused or uncomfortable, it encourages me to interrogate *why* I'm uncomfortable or research so I'm no longer confused. I hope that the hosts, producers, and people who make funding decisions for the show recognize that provoking this sort of discomfort is a strength of the show, not a weakness.",5
So good,12/15/2016,Yawn_Bored,I love Shereen and Gene. They're so smart and this podcast is necessary. I love it when Gene calls people from NPR his play cousin. So good.,5
One-way code switch,12/15/2016,WhoCares1980,"I may have a misconception or two regarding the premise of the podcast. After a number of episodes I'm coming to feel that the show is comprised of people of color speaking about various aspects of living in a white-media dominated society. The conversation is between individuals who identify as people of color, but I would reiterate one listener email which said that it doesn't feel like everyone is invited into the conversation. The hosts have a tendency to reflect on their experiences against a backdrop of white interpretation but leave a lot on the table in regards to interpretations of various ethnic groups by other groups. Or how about addressing the sliding scale of cultural awareness? I'd like for there to be white participant in the conversation as well as maybe a person openly acknowledging that they don't fit the mold of their skin color. There just seems to be a missed opportunity to touch on cultural nuances. I want to hear about life in between the lines. Not just from one side about he other.",2
Bigots preaching to a white guilt ridden audience,12/19/2016,Ilsickness,"I want to start this off by saying I have listened to every episode they have put out and will continue to listen to every episode they put out to gain a better understanding of the regressive left. According to NPR audience demographics listed on their site, they have an overwhelming listener base of wealth whites living in affluent cities and suburbs. This particular program is clearly market to their main demographic as well as affluent POCs living in mostly white areas. Their views on the reality most white people experience can easily be disproven if you have ever ventured an hours drive out of your major city. They have no problem trying to tell you about your own life experiences but would be all to quick to call you a racist if you did the same. They have this notion that white people are uncomfortable talking about race. I have to agree, but this is because it is not a conversation. We are expected to listen to how horrible we are and when we bring up a time a crime was committed against us that we felt was due to the color of our skin, we get labeled a racist. This podcast only focuses on how white wrong other races and never tackles bigotry between ethnic groups other than whites. Unfortunately, because they have been so successful in gaining listeners within their target market their bigotry will never be exposed.",1
Excellent podcasts,12/20/2016,Devlinjade,"Love this show! Makes me think about issues in a way that I normally wouldn't think to, given my background and experience. We need to have more conversation like this as a nation.",5
More consistency please,12/21/2016,Weihtoquiteweih,"Episodes aren't consistent. They go on break a lot/ play ""encore""podcasts and their episodes are so short. So I don't know what they are trying to bring with each episode. What's the point.",1
Thumbs Up,12/26/2016,Aviself,"I subscribed to Code Switch a while ago and listen to the episodes periodically but have accumulated a bit of a backlog. On a long drive a couple days ago, I went through the episodes back to back. As far as I'm concerned, there is a ton of value/perspective in these episodes...listening to the topics and contributors back to back and juxtaposed to each other was even better. There are so many themes that emerge over and over again...one of which was simply the importance of thinking about people as whole, complex beings not the oversimplified versions that are portrayed so often. Like other reviewers, I was surprised and not surprised to see some of the other reviews here and I agree that many of the reviews capture why the existence of the podcast is so important.",5
Great podcast!,12/27/2016,AP_SF,Always looks deeply and thoughtfully at issues of race and racism. Love it.,5
Code switch = what tea party is to moderate republicans,12/29/2016,173764ehsbd,"These guys (note: they will cry bloody murder to me referring to them all as ""guys"") are analogous to the tea party's relationship to moderate republicans. Code switch is a podcast that is actually a support group for overly sensitive hacks who preach about respect and freedom and repressing oppression by repressing freedom and respect for anyone who says or thinks differently. For example, they complain as nauseum about the Other, yet claim to be Other-ized. This podcast is in desperate need of a reality check.",1
Great Podcast,12/31/2016,Lorenjjhsfh,I really enjoy listening to Code Switch,5
Important podcast,01/02/2017,Agarcia815,"This is probably the most important podcast I listen to as a Person of Color. It helps me stay up to date on current topics, but more importantly, it expresses the concerns and thoughts I have on a daily basis. Best NPR podcast.",5
"Urgent, provocative, and thoroughly needed",01/04/2017,Bicoastal_pocho,"Long-time listener, first time review. The Real Talk episode on Obama and race is a treasure, in part because it looks back at the reactionary and counterproductive forces set loose during the past eight years. It reflects the kind of daring and thoughtful talk on race and culture that has made Code Switch a part of any well rounded podcast diet.",5
Thankful,01/05/2017,Flammifera,"I'm so thankful for this podcast - in a recent episode, they explored the 'explanatory comma' explaining who or what non-White people or culture are - but I'm grateful all the podcasters & writers on Code Switch share their thoughts and reactions. Leaving a review here to thank them for this work!",5
We need a POST-Election Analysis,11/10/2016,nu4jm6,"Listening to LATIN@ USA - I knew Code Switch was a podcast for me. And from the beginning, your podcast has been insightful, powerful, spot-on!",5
So Biased,11/10/2016,Rshaner,This podcast is so biased and it's rare if the hosts ever consider anything other than their own viewpoint. I would hope as journalists they would report more factually on subjects and not so subjectively.,1
"Thoughtful, impassioned, and absolutely necessary",11/11/2016,Lshop365,"Gene and Shereen and their guests are doing the good lord's work, speaking to NPR's white audiences (that's redundant) about racism, patriarchy, and other destructive institutions that our white privilege has allowed us to willfully ignore or not consider in full and truthful depth. I am particularly grateful for your most recent post election show. Thank you for helping us to process this horror we are now in and begin to make sense of how we move forward.",5
Insight from voices worth listening to,11/11/2016,Beezy36,"This podcast has helped me process through an incredibly tumultuous year in society. From Orlando, to the countless senseless deaths of black people, to the recent results of this years presidential election- I've turned to this podcast in hopes of hearing some dialogue that is honest, realistic, insightful, and hopeful. I have not been let down. Thanks codeswitch. Keep doing what you're doing.",5
Keeps challenging me,11/12/2016,PrincetoJoni,"Though it's not always an easy listen, it's one I'm glad I subscribe to as it clears cobwebs and flips things on their head. Your guests in particular make this show a worthy investment of my time.",5
Not helpful.,11/12/2016,rrosczyk,"A very frustrating show. I thought it was going to be an honest discussion of race.

It feels more like Cultural Studies 101 at a liberal arts college. This helps no one.",2
Dear fellow white people: Worth your time,11/13/2016,K. Stubbs,"I'm white, and I believe that it's my responsibility to try and educate myself about institutionalized racism and the privilege that I have as a white person. I've found CodeSwitch to be an invaluable source of information and perspective about what it's like to be a person of color in the US. The team is having really difficult and insightful conversations that I otherwise would probably never hear. I've learned so much from this show, and I hope that more people -- especially other white people -- will give it a try.",5
Ruby,11/14/2016,Gus Ruby,Excellent,5
Thank you,11/14/2016,Rachel S in Seattle,"Heartfelt thanks from a white woman struggling to feel some kind of hope after the election. I am grateful to be learning from journalists of color about how to be in the world as it is now. The feeling that my government is hostile to my values and even my self is new to me, but I know it’s not new to communities of color and other minority groups, and this podcast is helping me learn from these communities' expertise.",5
Awesome!!!,11/15/2016,Csmochilera,"This is a great podcast. Especially if you're white and you'd like to be more educated and informed about race... because as a white person, you really don't have to know this stuff. So you have to try! Just read through some of the negative comments on here... almost all of them are from white people who really should listen to this because they honestly have no idea what they're talking about... they didn't learn anything because they obviously weren't listening (or were so offended by being called white or privileged (which they are) that they just didn't pay attention). If you're white and you care about ""helping the world"", listen to this podcast and others like it (listed below).",5
Love it,11/16/2016,Orrangecolorado,This podcast is a great job of showing how race influences our society. It's educational and gives me lots to think about while being non-aggressive. Definitely check it out!,5
The show should be called white people are racist.,11/17/2016,Abdullah Moh,That is the subtext of every episode. The hosts demonize the white population of this country and blame white America for every problem facing minorities.,1
Absolutely love this podcast,11/20/2016,Piepie81,"This podcast is amazing! Finally I've found just the right about of news and personal stories to keep me interested. Both of the commentators are intelligent, caring and witty! I'd recommend this podcast to all of my friends.",5
Waste of time,11/21/2016,daminant,"I listened to the episode about young asians wanted their parents to understand BLM. It's a complete waste of time. The whole show was playing pity. Look, the girls are crying and so emotional, they must be right, right? The cast were constantly saying, ""Yeah, my parents are like that"" as if it was something to be ashamed of.",1
Informative and friendly,11/22/2016,Kareally,It's nice to hear numerous perspectives on difficult topics. I think they've done a great job to not pigeon hole people based on their race or alienate listeners.,5
Meh,11/23/2016,👁❤️👁,"It would be great to have more racial diversity/inclusion in regards to the topics covered. It's not bad, but it's not great. Example: DAPL has been a topic of discussion for 8+ months and they haven't covered it. Just like the rest of the mainstream media, native issues go unnoticed, pushed beyond the general public's concern. I was hoping for better than the status quo, but alas...",2
Love this podcast,11/23/2016,Colleenie514,"Thought-provoking, timely and more relevant now more than ever. Really thoughtful and honest discussions that help me to think of different perspectives. Appreciate the length of each episode and the multitude of backgrounds and perspectives that are represented.",5
my favorite go-to place for real discussion of race,11/24/2016,tippering,"I have become a dedicated listener to Code Switch over the past few months, and love the perspectives and questions that Gene and Shereen and the rest of the crew serve up here. They bring complexity and different viewpoints into the mix, centering the perspectives of people of color. Desperately needed, especially in these trying times. Keep it coming!",5
An excellent look at race in culture,11/25/2016,American Caesar,"I appreciate hearing a multitude of voices regarding the issues which we deal with, and NPR delivers a wonderful plurality outside of my own experience. Code Switch is indispensable, especially today.",5
Podcast treats minorities as though we're one group,11/26/2016,Pat114155,This podcast treats minorities as a monolith that should have one understanding of the world. It does not allow and is openly hostile to us having different opinions.,1
