Title,Date,User,Body,RatingWanted to like it but it is terrible,04/21/2016,Pseudobrainy,"For a show that is intended to go deep there is a decided lack of depth to the stories. There is merely exploitation of trite generalizations and sensationalism. Where’s the background? the research? the political and historical perspective? Just jump into a situation, spend three days, do a poor job of editing and stream it. I listened through to today and the skid road episode but won’t be listening anymore. The tone of this episode was truly awful, I did not find any content here that added any value to these tremendous problems in any meaningful way. Oh wait I see, I just went to the NPR website and see that this episode is a rework of content delivered on the radio a year ago. Well all the worse then. I am a serious podcast listener and am seeking thoughtful content developed for podcasts. This episode was a poorly cooked hash of leftovers.",1
Love it,04/21/2016,loloChrisine,"I enjoy listening each week . Well produced and I like how, it's based on real stories .",5
Awesome,04/21/2016,neuron1,Great podcast. Definitely check it out.,5
"Addicting, in-depth show",04/21/2016,"Dr. K, M.D.",Love this show. So often media tells the start of the story and doesn't stay with the story or go in depth but Embedded does,5
Great show!,04/21/2016,Uuduviboh,I want more! Kelly tells a great story!,5
Terrific!,04/21/2016,ErikB008,"Terrific stories, like mini versions of the Serial podcast",5
Human stories behind the headlines,04/21/2016,Jesse Gi,"Kelly McEvers works hard to get the human stories behind the headlines. We need more of this investigative, old fashioned reporting in the media to tell the whole story and put things in context. Thank you Embedded!",5
Stellar work!,04/21/2016,paramedic192,"Kelly McEvers does some stellar work here! From someone who regularly commutes 2 hours to and from work, I would love longer podcasts. 35 minutes a week just isn’t enough.",5
Embd is Engrossing,04/21/2016,Lizardink,"I'm a picky podcast listener. Serial got me hooked on this media, and I love that I can come here to listen to smart people talk about smart ideas. Embedded is my new favorite. I love Kelly's style and will be back every Thursday to download for my evening commute. More please.",5
Fascinating,04/20/2016,Kellyannecakes88,"Kelly McEvers does a superbly amazing job describing each situation. You really feel like you are right there with her. And these are stories that you probably would not hear about unless you were a local to the situation. They are the perfect length, right around 30 minutes. Sometimes I sit in my car after I get to my destination to listen to the rest of the podcast. I would rather be late for where I'm going than wait until later to finish the podcast! Kelly should really receive an award for this work. I am so interested to hear this news, it gives me a new perspective.",5
Please Don’t Get Killed,04/20/2016,JS Caughlin,Just listened to the PodCast about El Salvador’s gangs. It is sobering what other people have to endure simply to live. I hope anyone with an opinion about immigration “policy” would listen to this. Build a wall? How about build a bridge and help build stability? The U.S. had no problem dumping money back in the 80’s.,5
Engaging and informative.,04/20/2016,Llynnmcd,I heard about this from On Point. Excellent reporting in a very approachable format. Love it!,5
Excellent journalism,04/20/2016,Juan_P__M,"Kept me at the edge the whole time, I wish it would be a longer episode. Please keep up the excellent work.",5
VICE For Your Earballs,04/20/2016,WolfeLogic,"Thoughtful, insightful, and most times chilling reporting that everyone, EVERYONE should be listening to you. Please listen. Please vote in your government's elections.",5
So far? Excellent!,04/20/2016,Hiraaaah17,"Really informative, while not being dry or too news-like. I only wish the episodes were longer. Can't wait for more!",5
Excellent Podcast,04/20/2016,MAK211,"As others have mentioned, if you would like Serial or This American Life, you will appreciate the thoughtful, in-depth look at some of the major issues from the previous year.",5
Outstanding,04/20/2016,Geoffy B,"Brilliant, insightful, and completely engaging. Highly recommend.",5
"Intriguing, fascinating, edge of your seat",04/20/2016,Mroeger,"I love this podcast. It's smart, interesting, well done, thought provoking and keeps you on the edge of your seat. I listened to 3 in one day I loved it so much!",5
5 Stars!,04/20/2016,Embren9,"Another amazing podcast to get hooked on! Keep doing what you're doing, NPR - you're killin it.",5
Real Reporting,04/20/2016,lucindalynn,"So good to connect with this program. This is good old school quality reporting utilizing new formats. Wonderful work Kelly et al. I learn, I cry, I laugh, I want more. Thank You!",5
Fantastic,04/20/2016,Stupid girl,"Great stories! I'm half Salvadorian and hearing The Capital made me almost cry. To hear the sad truth that is going on in the world and how mishandled this (MY) country is, is very disheartening. Thank you for bringing this matter to people's attention. I hope you continue to bring real news to the world.",5
Amazing,04/20/2016,ChicagoLate,Such a great podcast! Very well done.,5
Some of the best in-depth reporting out there,04/20/2016,allie gator,Kelly McEvers is one of the most brilliant investigators and voices of our day. This podcast doesn't disappoint.,5
Whoa,04/20/2016,Musssiccccfahn,Great podcast!,5
Can't wait for the next installment!,04/21/2016,"Delighted in Laredo, Tx","Thoroughly enjoy this podcast. All of the episodes, so far, are outstanding. Immerses you in the narrative. Feels too real. I'm already recommending it to all my colleauges. Nice one, NPR!",5
Great new podcast,04/21/2016,Spotted wolf,Very well done. Very polished production with interesting stories.,5
Very Informative & Well Done,04/21/2016,MichToUVA,This is a great podcast that provides a unique perspective and often the real story behind current events. Highly recommended!,5
Excellent,04/21/2016,RMC63,The stories are well told with good pacing and interesting details. They are stories of our time.,5
"Great, insightful journalism",04/21/2016,MissWhich,I started listening for the Waco biker story and was instantly hooked. Riveting storytelling. Really appreciate the quality of journalism shown in this podcast. Well done.,5
Great stories and reporting,04/19/2016,otree32,Such a good show. Deep reporting and interesting topics.,5
Hope it gets better,04/19/2016,ToooCute!!,The show was interesting but was ultimately anti climactic for me. The Waco one ended abruptly and seemed half hearted to me. I'm surprised it's rated so high!!,2
Great new podcast!!!!,04/19/2016,Nickname-H8R,In-depth look at issues at home and around the world. Great addition to my podcast collection.,5
Gritty and informative,04/19/2016,Hair2play,"I love this podcast. It is gritty, raw and has an immediacy that conventional news reporting no longer provides (they are too busy obsessing with Donald Trump for that). The pace is fast and furious and it's very clear that the creators are trying really hard to find the backstory that is more often than not, more interesting than the headline it authors. The episodes on San Salvador and the TX shootout just kept me riveted. Can't wait for more episodes.",5
Best since Serial 1,04/19/2016,Shannyskillz,"Love this, wish it was every day!",5
Amazingly put together,04/19/2016,Tt149,"One of my favorite podcasts, amazingly out together and so informational. Always covering critical issues that I feel get put on the back burner by the media.",5
Breath of Life,04/19/2016,bilbomagens,Without stories such as these we become blind to the issues of our neighbors and our world. Inspiring journalism and heart wrenching first hand accounts of the issues that should be on everyone's radar in the international community we exist in today.,5
One of the best,04/19/2016,Rilotron,I only wish that Kelly could embed us further. Easily one of the best programs out there.,5
Incredible,04/19/2016,"Mogis, God of Slaughter","This program offers something that is a rarity in today's world full of top 10 lists and buzzfeed ""articles"", real journalism.",5
Well done,04/19/2016,Anne Brock,Great way to hear in detail about situations I would have never heard about otherwise. Great reporting. They put everything in to it.,5
Fantastic reporting and interesting stories.,04/19/2016,KayleighAleigh,This podcast is another example of great public radio. Kelly does an excellent job keeping your attention with her and her team's great reporting.,5
So far so good!,04/19/2016,Dalebert_R,Liking it so far.,5
Wonderful story telling,04/19/2016,Lib675,"This podcast is gripping and insightful. You really do feel like you are part of a biker group or at the mercy of a Central American gang listening to these incredible, moving stories. This is most certainly worth the listen.",5
Going beyond the story you read about,04/19/2016,Angla18,But it is a very thoughtful and insightful journalistic venture. I have learned so much from the journey of the reporters during their time investigating the story. This podcast truly brings the lives of those affected into perspective that we would not know had it not been for this in-depth reporting. Thank you so much for taking the risks and going the extra mile to bring the real story to life.,5
Insightful stories,04/19/2016,EmalMe,I like the approach to go deeper into a story to find out more behind names. The house was a great episode but sad,5
"Elite white woman talks about stuff she ""doesn't get""",04/20/2016,ezragoldman,Mainly shows how elite white people are so out of touch with the reality of the world.,1
Love it so far,04/20/2016,Lou McLou,"Based on the first 2 episodes, I'm hooked. Great reporting, great storytelling. The way they gained the trust of the bikers and the addicts was impressive and made for 2 awesome episodes. Keep up the good work.",5
Thought-provoking and compelling,04/20/2016,KHo56,I don't usually do reviews but the El Salvador gang violence episode was the first on I listened to and I was very impressed. Fans of Serial will like this.,5
Amazing topics,04/20/2016,JessicaLovesDogs,Super quick and super informative.,5
Love,04/20/2016,NickAtheChamp,This podcast is excellent. The team gets me nervous putting themselves in such vulnerable positions. Stay safe out there! Great work.,5
Favorite Podcast,04/18/2016,Astefanini,I have so many podcasts i listen to of all types and this is my favorite podcast. I wish there were more stories. Post more podcasts!! Amazing reporter. Her voice is so captivating. The stories she tells are incredible and the way she tells them. Post more podcasts!!,5
Fantastic!,04/18/2016,Jcthurman,This podcast is a favorite of mine. I love that the stories are done in one episode. They are done very well. Such a fascinating podcast. I highly recommend it!,5
Trying hard to sound like Serial,04/18/2016,Bzzzzzzz,"Very formulaic, narrator aping Sarah Koenig’s “style” - half-curious, half clueless. I guess this is supposed to sound more relatable? But it comes off as amateurish. The narrator needs to develop her own voice, this is just derivative.",1
Brilliant,04/18/2016,MrsKDeyeeyeA,"Every episode is engaging, like a great book that I never want to end!",5
Yes!,04/18/2016,RAYCEism,I am so grateful for the intermingling of news factuals and on the ground coverage! This style feels so natural yet still intellectually stimulating. Easily worth taking the few minutes to rate; easily worth all 5 stars! I hope this podcast continues to flourish so I can see what interesting topics are ahead.,5
Love this podcast,04/18/2016,Houndstoothy,"Wish the episodes were even longer, it's so riveting.",5
A great podcast,04/18/2016,Grouponjunkie2,Absolutely love the content. Only gripe is that it's too short. Feel like 1 hour would be better suited.,5
Well Worthing Listening,04/18/2016,DESFAK,Thought provoking on many different subjects. Getting a perspective on those we may not know except through the news sound bites. One of the better podcasts,5
Visceral storytelling.,04/18/2016,Madeofpeople,"Without hyperbole, some of the most thoughtful deep dive works of narrative journalism in modern times.",5
"Great, but it can go deeper",04/18/2016,lllamg,"This podcast is great, I just wish they could go further on the subjects they cover. It feels at times they stop when I really want to know more.",4
Awesome!!!,04/18/2016,Barbgibbs🐢,"This is such a fabulous podcast. I have really enjoyed all of the episodes so far, but Capital is really incredible!!!",5
Classic NPR,04/18/2016,Chris1222222,"If you love NPR, you'll love this. It has that classic NPR feel and style of storytelling and a great in depth feel. I've been waiting for an investigative journalism podcast from NPR and this is it",5
Amazing podcast! One of my favorites!,04/18/2016,Ohmylorde90,Incredibly insightful and captivating stories that I wish there were more of them to listen to! Embedded tackles dark topics with such detail that it really gives the listener a glimpse into the world they're covering.,5
Go listen now!,04/18/2016,amw277,Found this podcast through it being featured on another podcast. Thankfully!! It's a great concept and the conversations are so insightful and rewarding.,5
"Exciting, interesting, captivating...fun!",04/18/2016,2ndAmendbyGlock,"I just started listening to this podcast and I'm already addicted… I love it… The quality is superb, the topics are interesting and I can't wait for more episodes!",5
Solid and engaging,04/18/2016,envyEye,So far this has been as good to listen to as can be with mindfulness to the subject matter. The investigations feel well put together and that they take the time to make it into a presentable cast.,5
Unbiased & Indepth,04/18/2016,hazzeltoz,This is a great new podcast in the style of Serial but each episode is its own story. Kelly is a great storyteller.,5
Thanks for in depth journalism,04/19/2016,Inittotinit,Thanks for in depth journalism,4
Story behind the fast headlines,04/19/2016,Sophgunnink,"Today news seems to be faster and faster with a story entering and leaving the cycle within a matter of days. Embedded did the exact opposite, they tell the story in a slow methodical way that allows me to understand things I had previously just read the headline about. Kelly is very personable. She asks the hard hitting questions but is understanding enough to get almost anyone to open up to her.",5
Embedded,04/19/2016,SHERORD,Great Podcast NPR-looking forward to the coming weeks episodes.,5
Serial meets Revealed,04/17/2016,Kamikaze pizza,"There have only been a few episodes at this point, but this is a great longer-form journalism podcast that lets you really sink your teeth into some cool subjects. It's Serial meets Revealed. Good stuff.",5
Fantastic !!!,04/17/2016,RyeWit,Great insight into worlds I've always wandered about and never pursued !!!!,5
Well done reporting,04/17/2016,Fudo 77,"Goes into detail on the stories that capture the country's attention for a day, and then seem to be forgotten.",5
Great narration,04/17/2016,alesugar,I enjoyed these stories. They are very well edited. Great journalism. Can't wait to listen to more.,5
Great!!,04/17/2016,Craycray12,Great insight and behind the scenes reporting into popular news stories from around the world. Keeps my interest piqued! Love this!,5
I like the nuance,04/17/2016,lisalisa1913,I like the idea behind the show since there is only so much you can learn from the medias minute and a half coverage of events because they are trying to break the next big story.,5
Interesting. Never a dull moment.,04/17/2016,Thomas DeVito,This podcast is extremely captivating and insightful to worlds not experienced by all of us.,5
Interesting stories,04/17/2016,CSkiby,I have enjoyed all the episodes. Intriguing.,4
Fascinating.,04/17/2016,D Cupp,"Even though the stories have all been about sad situations, the way it's covered is insightful and interesting. I feel like it's the podcast Vice would make.",5
Embedded is excellent,04/17/2016,Pavesiriccardo,"Embedded is very very interesting, thoroughly researched and excellent story telling",5
Gripping,04/17/2016,PinterestAddict1111,I actually kept driving so that I could finish the episode. Each story is presented in such varied and unique perspectives. I really wish there was a stockpile of episodes.,5
"Great premise, wonderfully reported.",04/17/2016,Gemjennc,I often read news stories where I wish I could find out more. This show goes deep and puts me at the heart of a story. I look forward to each new episode.,5
Excellent show,04/17/2016,Gplkrr,Excellent show,5
Brilliant real life story telling podcast,04/17/2016,北 Matt,"Continuing in the tradition of great story telling podcasts , this is a really interesting podcasts that takes an in-depth look at news stories .",5
Great,04/17/2016,A Sullivan,Great In-depth story coverage of news items,5
The next addictive podcast,04/17/2016,jjharvard,"Embedded is like a tailored newsfeed with added suspense. Fearless and unrelenting, I can't wait for the next one.",5
Amazing Podcast.,04/17/2016,Fishman252525252525,If you are a fan of serial this is for you! One week stories that are so compelling. Keep up the great work!,5
Insightful and Raw Reporting,04/17/2016,SpyderMonkey001,"Great look at stories that are often glossed over on mainstream media networks. If the normal newscasts give the tip of the iceberg, Embedded surely gives the rest.",5
Excellent reporting and storytelling,04/18/2016,GT40oz,"If you like deep dives into issues that only get 30 to 60 seconds on the news, this is you podcast",5
Cossacks and Banditos,04/18/2016,RevMcR,Fascinating interviews with the bikers about the Waco shootout. Looking forward to future episodes.,5
Love it!!!!,04/15/2016,Aliestin,I really enjoy lisrening to this podcast. Amazing!!,5
GREAT podcast!,04/15/2016,Shelikk,"Kelly is such a great story teller. This is a 'Serial' style approach to news stories, (season 1, not season 2). Really enjoyable to listen to.",5
Amazing!,04/15/2016,MelissOT,"This podcast is completely different than any other way I have listened to the ""news"" before. Love the raw interview style and willingness to meet people where they are in their natural environment. You don't just hear the ""what"" with this podcast, but you understand the ""why.""",5
"Great Reporter, But Too Depressing",04/15/2016,zmlode,"If you like your Podcasts to lift your spirits when you're stuck in rush hour traffic after work, this isn't for you. Really good reporting and story telling though.",3
Keep 'em comin'!!,04/15/2016,Nparrrrrrrrr,Great new show. Kelly is excellent. Hope this show is on for years to come! Keep the $$ flowing so she can keep making 'em!,5
The Capitol.,04/16/2016,TOasT14072,If you remove the minutia the show is only about 6 minutes long. The details surrounding the topic are not pertinent. Lots of filler.,1
Embedded,04/16/2016,Rick from SC,"What an awesome podcast. If you want to know what really happened in an interesting top story, this is the place to go.",5
Fantastic,04/16/2016,Kmw2000,Fantastic show!,5
Great podcast,04/16/2016,BusyMama,Fascinating reporting that presents a deeper insight to stories from the news by presenting the personal perspective of those involved. Very enjoyable.,5
S/O Howard Stern,04/16/2016,amber 808,Yup. Embedded is Intriguing & captivating & allows a glance into the dirty dark places I am so curious about....,5
Great new podcast,04/16/2016,Booghggg,"So excited to have heard this on the radio the other day, definitely hooked!",5
In depth reporting,04/16/2016,Ysakab,Can’t wait for the next episode.,5
Amazing Research and Great Topics,04/16/2016,megs1768,It's amazing how much time and effort they must put into each of these podcasts! So interesting! I love the audio and interviews!,5
Journalistic Excellence,04/17/2016,gilesStyles,Embedded is one of the finest podcasts I have ever heard. The Capital episode was particularly insightful and challenging. Thanks for your bravery and dedication to reporting meaningful stories.,5
Awesome,04/17/2016,Alx878,Great stories,5
outstanding and in-depth,04/17/2016,toheckwithnickname,thoughtful and insightful reporting,5
Fantastic,04/17/2016,qatundiscovered,This is a great podcast with fantastic storytelling. The perfect show for me now that Serial is on hiatus. Also I love the music.,5
Exceptional story telling,04/17/2016,Forever from Massachusetts,This method of in depth reporting is extremely captivating and the creators are doing an exceptional job of focusing on current issues. Their determination and ability to access primary sources is what makes each episode riveting. NPR podcasts are like a rabbit hole of amazing podcasts. Each one I listen to plugs another one to try and I've enjoyed everyone of them. This is the most recent I have found in that rabbit hole of exceptional journalism. Thank you.,5
Yes,04/17/2016,Charlie_Wells,The type of reporting that the world needs and come to expect.,5
Worth Listening to Each Time,04/17/2016,lilkatie1979,"I am really enjoying listening to Embedded. It's great, yet humble, and in-depth reporting about the people and places inside the human interest pieces we read and hear about everyday and sometimes miss. Give it a try!",4
Great,04/15/2016,Pho1sgood,"Captivating new podcast, definitely an eye opening experience",5
Hooked!!!!,04/15/2016,Average Sue,What a great podcast! My only disappointment is I heard about it so early while listening to fresh air and there are only 3 episodes on file😒,1
The best way to make it through a long run.,04/15/2016,Livvy1024,"I've been super into podcasts lately and Embedded always keeps me at the edge of my seat. It's perfect to put it on while I go on runs! Love the concept, honestly wish the episodes were longer or multiple parts!",5
Great in-depth coverage,04/15/2016,Bwaffles,I love this podcast! It lets you go back and really get into things that may have just been blips on your daily news update months ago.,5
Love it,04/15/2016,crazyjoejj,Absolutely can not get enough. Love great story telling and this podcast has jumped to the top of my list!,5
Really well thought out and very interesting but sad stories,04/15/2016,OlgaBogo,"I really enjoy this one. The stories are very captivating and touching, some I haven't heard of so its also something new.

Highly recommend!",5
"Great concept, great host, great stories.",04/15/2016,Swimfan255587411,Check it out.,5
"Informative, well done",04/15/2016,Museoprado,I have only heard two episodes and I'm hooked. Very interesting and informative.,5
Disappointed --Definitely Not the Quality of Serial,04/15/2016,Birdgrrl,"I love in-depth reporting and was looking forward to this podcast. However, I find it voyeuristic and somewhat shallow. The reporter almost seems like a naive suburbanite who thrills at exposure to ""the dark side."" What I found missing is sensitivity to the interviewees and possibly a lack of enough life experience to thoughtfully mine sensitive subjects. The reporter's cheery style and awkward questions made for too many cringe-worthy moments. The podcast also fails to put stories into their larger context. There are a lot of political issues impacting the Indiana addicts story related to education, the governor that could have made it more interesting and help people understand the complexities of how this addiction/HIV crisis happened in bucolic Austin, Indiana. The next story on the biker fight in Texas struck me the same. ""Ohh--bikers are kinda cool and scary!! What's their story? Look at us, we get to talk to cool, scary bikers!"" --is the tone of the story without a whole lot of other less than obvious insights. Other podcasts do it much better, especially This American Life, Serial, Only Human. Skip this one unless they up their game soon.",2
Great Podcast,04/15/2016,SentientEgg,Well produced and compelling. Even the stories I don't think I'll have any interest in are riveting and intriguing due to the production values.,5
Lack of research and empathy,04/15/2016,raterkater,Kelly McEvers seems to do little research on the topics she is reporting. She also lacks empathy for people who are struggling. I downloaded three episodes at one time to take with me to work. I gave each one a fair shot before giving this review. I have deleted the three I downloaded and will not be downloading anymore. I was very dissapointed with NPR for allowing this garbage to be aired and to have their name attached to it.,1
Brilliant concept and successful execution,04/15/2016,93cs,I love this podcast. It takes on interesting topics in an investigative manner that connects listeners with the story. NPR never fails to impress me - They tell the news of the people.,5
"Riveting, Illuminating, Heartbreaking",04/15/2016,Shamukillerchick,"Riveting, Illuminating, Heartbreaking. In depth reporting, beautifully done.",5
Love it.,04/15/2016,Peeved about this nickname,Well done.,5
Very Insightful,04/15/2016,KLJ25,"Let's you learn deeply about news stories in the USA that you may not have otherwise. My favorite so far was ""Bikers""",5
