Title,Date,User,Body,Rating
Amazing podcast,04/22/2019,bulgaria not included,"Amazing in-depth reporting, engaging stories uncovering issues of great concern. The latest series ""How it Ends"" with reporting by Ruth Sherlock is phenomenal. I'm anxiously awaiting each episode. The only thing I don't like is the theme music. It's unnecesarily dramatic. Please consider changing it.",5
Fascinating in-depth reporting,04/20/2019,RN1371,"Every series is a well-documented story, very human in nature. The hosts are clearly dedicated to a compassionate and factual story delivery related to a contemporary topic, while letting their subjects speak in their own voice and from their own experience. Highly recommended.",5
Thank you!!!,04/19/2019,Luminous Connector,Great reporting and storytelling. I learn so much from your podcast. Excellent work. Keep going. Thank you!!!,5
Clearly anti-American. Very disappointed.,04/19/2019,gunguy98,"There is a clear, leftist vibe to these podcasts. I stopped listening after reaching one where the hosts are tell the story (in a very sympathetic way) of Muslims who join Isis and want to come back to their homeland now, after things clearly didn’t go the way they planned. Absolutely disgusted that they would sympathize to this kind of treason. They should be imprisoned.",1
"Heartbreaking but engaging, interesting and needed",04/18/2019,London99Don'tbuy,"Sad, incredible stories about the people affected by isis",5
Amazing,04/18/2019,Politics Momma,Loved it. So informative.,5
Really?,04/18/2019,Bigtuna18!,Embedded has so much disposable income that they are gonna waste there time reporting on ISIS members. How about something worth your listeners time! How about the 1000 issues happening right here in the USA. So disappointed.......🙁,1
Awful in every way you would expect,04/14/2019,BCF200000,Per usual,1
One of the best!,04/11/2019,MethadoneMike,"My wife calls me the 'NPR' JUNKIE. That's because a good 60+ % of my podcasts come from the need outle.
With that said, Embedded ranks right there at the top. It does just what it claims and Goes Deep.",5
I listen to lots of podcasts. This one is the best.,04/08/2019,Surrounded by Children,Embedded is the best podcast out there. I love the reporting and the humanity. I hope there are a lot more episodes coming!,5
First season kills it. After that.....,11/01/2018,Metal Mike Tattoos,This use to be my favorite podcast but has gone done hill since the first season. Return to that format because a whole season on why you hate Trump got boring quickly. I want to learn about stuff not be bored to death.,1
Partisan and sarcastic,11/04/2018,rep10937,"While the stories she presents are interesting. She does so in a way that does not allow for any differing opinion. I’m a bit tired of all the sarcastic comments and tones when talking about anything related to republicans or our police forces. Take a look at the economy! We’ve done a good job! How about some journalistic integrity? I for one, would like a podcast like this with some of that involved.",1
Getting to Leftists,11/05/2018,Statewes,Used to love this podcast but it’s gotten way to left wing political. Please stick to the good stories you originally had and get off the right wing bashing. Thanks,3
Are you related,11/09/2018,premenopausalme,Are you related to Sara Koenig(spelling) you sound exactly like her. Love your shows,5
Way too long between episodes,11/12/2018,SpaceIsOnly,"If you're gonna podcast, then cast. There's way too long between episodes.",2
Leftest,11/13/2018,Squarebutt$&@&&$&91874,"Why not ask the question, what Obama did for us black folks!
You won’t cause you know!
He used em",1
Always Getting Better!,11/25/2018,CWinders,"I started listening to Embedded when it was first released in the summer of 2016. The breadth and depth of material that Kelly has covered since then amazes me. She and the show are a versatile duo, pushing sensitive buttons and deep diving into topics that being uncomfortable truths to the surface. Keep up the incredible storytelling!",5
Love this podcast!,01/15/2019,Marissa939597,This podcast is so interesting and I’ve learned so much. I love how you take today’s biggest headlines and put real life stories to them. Helps to contextualize the importance of these headlines. Thank you!!!! Please do more!,5
Great Show!,01/25/2019,DA setters,I love the fact that they take the time to be accurate in their reporting. The coal stories really hit close to home. My family is from the region and in my lifetime seeing the decline is really heartbreaking.,5
The House,01/31/2019,salindquist,"I really like Embedded and would give this 5 stars but I am noticing lately, and not just in this podcast, but even for example Oprah’s super soul conversations which I listen to quite a bit as well, at how fast people are talking. I just want to comment on the speed and cadence of the narrative. I am not sure if this is something podcast hosts have fallen into by nature of the task or if something else is going on, but for some reason I feel like the narration is all of a sudden on overdrive. Curious if anyone else notices this as well.",4
Really Deep Dives by the Inspiring Kelly McEvers,02/05/2019,Alicia Magee,"I don't think I've found any other podcast that goes so deep into important issues like this. This podcast knows what it's trying to do and it does it well. You will come out far more informed than you thought you could be, and McEvers is an excellent host.",5
“After the Storm” is excellent,02/21/2019,Charli Bull,"I re-lived the desperation of not having power and the relief when it came back while listening to this episode. And my family and I were very lucky because we got our power back in 47 days. The incompetence of both the Federal and local government in the aftermath was incredible. The problems in Puerto Rico persist today and we don’t see any light at the end of the tunnel... there is no viable economic plan, we feel like 2nd rate US citizens, the government continues politicking with every possible issue, oppressive laws, like the Jones Act, continue to strangle every citizen, and there is little knowledge in the mainland of all these issues. Thank you, NPR, for bringing some of these topics to light.",5
Tremendously engaging,02/21/2019,Cynroles,I love all of the content! I’m always excited when I see there’s a new episode available. My ONLY complaint is that there’s not more content being uploaded more often. I understand it takes time to cover the stories the way this podcast does. I just want more! Can’t wait for the next episode,5
An NPR Gem,02/25/2019,StPeteFlJames,"Focuses on critical issues, tells a compelling story, balances in-depth with the big picture, and Kelly is a pleasure to listen to. This one of the few podcasts I really look forward to.",5
Captivating and creative,03/05/2019,wendy nathalia,I love the perspective in this series. Great job diving into these topics in such a detailed and efficient manner. So many interesting stories that you usually don’t get enough of in online articles or news,5
Great podcast,03/11/2019,jhbb 490,"This is not the regular type of podcast I listen to, but I have to say it’s great. I love the style and the voices are easy to hear and the stories are so interesting. It’s an A+",5
EVERY Parent should listen to this!,03/22/2019,NgaireSG,"He groomed adults whilst abusing children. This should be a cautionary tale for all parents. Listen to your children and believe them. Your first reaction to their disclosure is so important. Listen and believe. Report, report! Thank you for doing this podcast.",5
Great job..,03/28/2019,juanc mtz 21,"This podcast is great in order to have a clear idea of how different topics affect our everyday life.
I enjoy every episode, please keep it coming.",4
How it ends is amazing,04/06/2019,kayeskayes,"I just listened to the first episode of how it ends. It is an amazing feat of in depth journalism and asking ethical questions. I believe that all the Jihadis chose to join the fight in order to impose their twisted worldview. They are not redeemable. These guys should die where they stand, maybe hurry off to meet the waiting virgins. However, after listening to episode one I am questioning my own view. Bravo for putting some doubt in my already made up mind.",5
The Vocal Fry is Strong in This One,04/06/2019,arfy66213467,So much more entertaining after Mueller findings. There were tears in the studio that day...,1
Great work Kelly and Team!,07/19/2018,Joem500,The story-telling style of real news events with the facts and frontline reporting is phenomenal listening. Great work. I felt better about Obama's Syrian policy and understood more about my heritage in the Coal Mining country after tuning in. Thank you.,5
I cannot get enough,07/20/2018,Ymom,"I am always so sad when an episode ends. These casts are brilliant, such an examination of topics that I didn’t know that I absolutely need to know. Thanks Kelly and team!!",5
I have listened to the political episodes twice. So much content.,07/25/2018,ska121189,Love this podcast! Wish they would do more episodes on Trump department heads.,5
Great journalism,07/28/2018,Hemispingus,Love this show’s deep dives on its subjects. I feel like a better human for it.,5
"Detailed, fascinating and draws you in",08/06/2018,Campaign junkie,I love when I see another episode has landed in my phone.,5
"Great show, I cannot get enough",08/08/2018,heman8400,This is what good journalism is. In depth. Fair. Real. There isn’t a better investigative podcast available. I cannot wait for each new episode.,5
Coal Miner,08/11/2018,Lemmelook5,As a Illinois coal miner of 10 years from a mining family third generation the miner piece was so well done from the politics of Mining to the real reason why coal in the US looked up for a second. As a black and educated man who did coal mining to paid for College in my twenties thank God they closed that death hole. The money is not that good for a person with any talent at all.,5
Embedded,08/12/2018,hrehr,This podcast is excellent. This is investigative journalism at its best.,5
Amazing podcast,08/13/2018,klsinva,Incredible reporting and production. Intelligent and captivating stories. Thank you Kelly.,5
Great,08/16/2018,kinger611,Great show. Looking forward to next episode!,5
Rerun,08/18/2018,Atholder,Why do these NPR podcast put out “new” episodes that are just reused with a new minute intro?,2
the trump podcast,08/19/2018,symphtronic,this show is obsessed with Trump and Trump voters. As if NPR wasn't already the 24/7 trump network. enough already!,1
Has gone down hill,08/21/2018,amdbdbkendb,"Used to be a really good show when they’d actually get EMBEDDED to make an episode. Now they just go for the low hanging fruit talking about Trump, to the point where they’re even in repeats with the topics they focus on with Trump",2
Finally a voice I can listen to...,08/21/2018,rainy day in california,Kelly McEvers has the best voice in podcasting IMHO. And the content is amazing... Thank you!,5
Very informative and very interesting!,08/22/2018,gEExr,"This is one of my favorite podcast these days. Kelly McEver is doing a great job every week in creating a story that is tight-knit, interesting and well researched. Outstanding. Keep it up.",5
Fantastic,08/28/2018,Allison_Pons,Kelly McEvers is an amazing journalist. This podcast is always interesting.,5
Completely captivating,08/30/2018,Theresa B Sayers,"I am addicted to this podcast. It is completely captivating, thorough, exciting, thought provoking and relevant to today’s issues. Keep up the good work.",5
Very informative,08/30/2018,drinkme22,Very well researched and great interviews!,5
"Informative, emotional",09/02/2018,Adarzie,This show is amazing. I have learned so much about the context behind what’s happening in the world. Huge fan.,5
Awesome,09/06/2018,Charlie19Clay,"Love this podcast. It’s interesting and intimate. I often get a perspective from the show that I wouldn’t have gotten otherwise, and that is worth a lot these days.",5
Back to the old format!,06/22/2018,Johnfhdis,"PLEASE go back to the format of Season 1. There’s so much police video and Trump coverage in the news already. In-depth, original stories were the best part of Embedded, and made it the best podcast on the NPR network. Now every week feels like an uninteresting retread.",1
Should be required listening for all HS Students,06/26/2018,t.sneed,Embedded is informative and digs deep into various stories. This podcast is for all ages and we should encourage people to listen to this and similar podcasts to get a better understanding of what people throughout the country are going through.,5
Amazing detail,06/27/2018,Scotty Mc58,"Really great reporting, in very great detail. All subjects are treated with respect.",5
Not very diverse.,06/28/2018,theoriginalwjburr,"If you want to hear how much they hate Trump or how coal miners get their jobs, then this is the podcast for you.",2
Fantastic story telling,06/28/2018,NPR SheFan,Kelly McEvers is an amazing talent who has a natural skill in conversation which draws the listener in. Her stories offer enriching perspectives. The show is extremely well produced.,5
Totally biased,06/29/2018,Southern professional,"Ms. McEvers is one of those reporters whose take on the news is totally biased. She is not an objective reporter, rather a podcaster out to further her anti republican agenda. The first season of Embedded was very good. Unfortunately since then it has been increasingly disappointing. After deleting so many episodes I have now unsubscribed.",1
Not a balanced perspective,06/29/2018,Andrieux,"Everything this podcast creates is from a neo-liberal perspective. Im no fan of trump, not a republican either, but their bias shows a bit too much in everything they report",1
Great investigative reporting,06/29/2018,Erin79705,"I respect the work and opinions being produced here. I often disagree with folks being interviewed, but I’m curious about their lives and experiences nevertheless—and I think McEvers feels the same way. Some people may criticize her conclusions, but I believe she arrives there using a balanced and rational approach. I applaud the show for having the chutzpah to call a spade a spade in this degenerating and disingenuous age.",5
❤️ ❤️❤️,06/30/2018,GracieJoy66,I love every episode! No complaints. I love the thorough reporting and the topics that you tackle.,5
My very favorite,07/01/2018,sbuckt,"I get so excited when I see a new episode available, and it doesn’t even matter what the subject is. Kelly McEvers’ thoughtful reporting makes me a better person for having listened. All the stories are presented with the perfect blend of empathy and skepticism.",5
Excellent journalism.,07/06/2018,cb216100,"In a world of garbage news it’s so refreshing to listen to well researched, thoughtful journalism. I’m entertained as much as I am enlightened by these stories.",5
Necessary.,07/06/2018,jlwerd,I needed this podcast. I don’t get politics and I have no idea what Trump is up to. This helps me,5
Excellent in-depth reporting on social issues,07/08/2018,AliceRosewonder,A lot of time and consideration is put into the reporting. Makes issues more captivating and interesting.,5
Excellent,07/10/2018,Househagen,Excellent stories. Excellent podcast.,5
The best podcast,07/12/2018,jeannex91,"I’m gonna have to say, Embedded is probably one of the best, well made podcast out there. I am always looking forward to the next episode. Keep up the good work!",5
nprnerd4life,07/14/2018,nprnerd4life,I appreciate so much the depth in this show. Thank you for taking so much time to research and make these episodes! We need more of this kind of news.,5
Incredible Reporting,07/17/2018,Alllllllie,"This is an absolutely fantastic show! Kelly is an engaging storyteller you really brings you into the story each week. No matter the topic, I am also intrigued by the stories on embedded and the way the podcast is crafted. If you like Serial, S-town, Invisibilia, This American Life, or just good reporting, you will love this show!",5
ALL GOOD,07/18/2018,Bachspielerin,"The TRUMP and COAL STORIES were especially good, but I appreciate the total involvement in each story, giving a full and 365-degree picture of each person and event involved.",5
Left wing extremist’s view of the world,07/18/2018,Danielwang88,"It is fun how Americans see the world. On one hand, they think view their poors, inner city population, veterans are lazy, sick people, on the other hand they believe all foreigners are angels should be welcomed to this “greatest” country. One hand most they do not believe votes count, on the other hand, they want to give all illegal immigrants right to vote.",3
Kelly et al,07/19/2018,Jba314,Amazingly informative . Thank you so much.,5
Love Embedded,06/03/2018,KathyB3000,Providing podcasts that tell the stories of real people really brings the listener into situations otherwise not able to fully appreciate. Very well done.,5
One of my top 5 podcasts,06/04/2018,Tecsi,"Fabulous. Great investigative journalism. Kelly McEvers has a great voice to listen to—animated and varied, so very pleasing.",5
There are more things going on besides Trump,06/06/2018,Tim McFadden,We see enough of it in the news. There must be better things to write about besides more Trump.,1
Started good,06/06/2018,RainerD7,"Started out great, then got too political.",1
Coal stories was a great series.,06/06/2018,jonbruck,"Really enjoyed the first five episodes on Coal. The format of hearing from multiple people over time was really interesting, and I hope you will revisit them at some point in the future.",5
Understanding,06/06/2018,Vicki LTP,You should alway want to see the others side point of view. Thank you for such great reporting.,5
"The Bikers episode, April 2016",06/07/2018,Mateoman11,"It’s odd when the narrator says: “We don’t know the role the police payed in all this.“ Actually, you do. The police have a chain of command, follow procedures, write reports, and do internal investigations. Yes, police make mistakes at times. Yet, are much more trustworthy than biker clubs. You did an investigative report for a few weeks. Law enforcement lives there, know the streets, know the criminals, and take their time. “What role did NPR play in all this?” They didn’t do much homework, and then generalized about what might be. Seems like poor reporting.",1
Not really about coal,06/08/2018,Guy guy guy guy,I subscribed to this podcast in season 1 right after Trump got elected thinking that it was going to be a fair critique on the presidency and quickly found out that these “reporters” had an agenda and unsubscribed. I came back after hearing a promo on Planet Money and was hoping the journalists took a different route. But now it has become a Podcast all about who were these voters that were obviously uninformed in their decision making and cost the Democrats their surprising presidential loss. So if you are left wing enjoy. If you are moderate or right wing you will easily hear the propaganda.,2
Coal Stories Enlightenment,06/08/2018,CynthiasDaughter,This was my first EMBD series but certainly not my last. The humanity and deftness with which the stories were told gave me insight and made me feel connected to the people and the community being highlighted in a way I would never have expected. Thank you!,5
Coal Series,06/08/2018,Newsguy8,Amazing Journalism...Thank you. Binged all 5 episodes on my daily walks. Can't wait to explore more from these outstanding journalist.,5
Difficult voice to listen to,06/09/2018,79cmb,"The content is great on Embedded. However, I have a really hard time with the host voice. Not sure if it’s the tone or the way she stresses her words. Anyhow, I’m having to let go of this one unfortunately.",3
Details on trump outstanding,06/11/2018,petriebunch,Great in depth history on the vulgar mans rise to power.,5
Great in-depth content,06/11/2018,SoCal-REO,I appreciated the review of the Trump collusion facts. There are so many characters involved that your methodical podcast series was extremely helpful in spelling it out.,5
A must listen,06/14/2018,Colinalcarz,"Especially the episodes devoted to understanding Trump. Incredibly carefully prepared, documented, cited, and written. Sometimes I do find a repetitive inflection pattern somewhat annoying but for the most part, very professional.",4
Awesome Podcast,06/16/2018,jsslanders,Embedded is such a great podcast. Kelly and her team take a deep dive into stories that you will never get in a 2 min newscast. It’s insightful and engaging reporting.,5
The coal stories,06/16/2018,Juju19876,"Are exactly the kind of journalism we need in this country!

Great work!",5
Coal,06/17/2018,Flerk69,"Nice series. Well done, informative, offered context and even some solutions.",5
On the decline lately. Shame,06/18/2018,Jeltaher,Took off a star because it’s been declining. Coal series was not good.,4
Great podcast,06/19/2018,Cotation,"Coal stories wasn’t nearly as good as the previous episodes. They could have cut that short by half. Otherwise, great podcast, I’m sure lot of hard work!",4
Love this Podcast!,06/21/2018,Npruitt99,"This is my absolute favorite. I didn’t find it until the Coal Stories, which is what made me fall in love on the first place. I love how it took me there and helped me to see the issue through their eyes. After that series, I went back and listened to prior episodes and they were top notch. My #1 podcast for sure.",5
Phenomenal Storytelling,05/24/2018,RSimonLee,There's a nuance to Kelly's style of storytelling and the audio editing of of this podcast that truly sets it apart. You can tell she loves what she does and she does extensive research to bring as much to the listener as possible. Great podcast.,5
Pro-Trump podcast - Refreshing!,05/25/2018,Luv2shopping,The coal miner episodes are squarely pro-Trump. Always enjoy hearing some good news for a change.,5
As good as it gets.,05/25/2018,realitylover,"Five stars isn't enough. This podcast is phenomenal. The ""Trump Stories"" rocked my world—particularly the one about Kushner. Bravo! Kudos! Applause!",5
Great voice!,05/25/2018,emmlehr,"I’d put Kelly right up there with Anna Sail and Phoebe Judge. She has a great voice, writes and speaks with affable clarity, and she tells a great story. I appreciate her reporting so much!!",5
Embedded,05/25/2018,mickO'B,"Just eneoph red neck, just enoeph smart people, thinking about their lives, giving us all eneoph empathy to maybe see each other as one people again",5
This podcast!,05/26/2018,RaeAC,"All I can say is that I want more!! This is awesome and interesting information. And can I just say, the series in Trump! O my goodness I couldn’t get enough and honestly just wanted to get in a heated debate w someone about all of this feeling fully armed.",5
Similar different,05/26/2018,An avid podcast lover,Joe Bart likes tools,5
Great,05/26/2018,Kapjea,"Bro, it is dope fam",5
A must listen to,05/27/2018,Fast FJ,"This show is such a gem!!! The reporting is superb. The series on Trump and his cronies is very, very interesting.",5
"Content is good, Delivery is mostly good",05/27/2018,j footprint,"OK, This isn't a bad program, but I have a very difficult time listening to Kelly's delivery and cadence. I don't know anyone who talks like that in real life, and I find it terribly distracting with respect to the content. It's not breathless, like the beautiful people on the nightly news, but it is overenunciated, and stilted.",2
Better than a detective story!,05/29/2018,Curious and Concerned,Thrilling reportage. Thank you! Can’t wait for more...,5
One of my favorites,05/29/2018,mrespiritu,So good. Only wish there were more episodes. They will sometimes go weeks/months till we get a new story but it’s worth it.,5
Fascinating.,05/30/2018,Meg_ers,I love the deep dives. LOVE this podcast.,5
"Great, In-Depth Look at Things that Matter",05/30/2018,Go4sharon,"The team at embed continuously knocks it out of the park. Have listened to the past couple of seasons and just started the Coal episodes, which are so important. I’m thankful that they are here to tell them.",5
Great listening,05/30/2018,Racer1010,"I really enjoy listening to this podcast because the host explains the topics in a way that I can actually understand the issues they are trying to convey. Episodes are not too long, in fact maybe a little bit too short as it always ends as I am getting extremely interested and then I have to wait A week for the next episode. Most NPR fans would enjoy this podcast",5
5⭐️,05/31/2018,Si como no,Great stories and great productions,5
"Great podcast, very interesting and well produced content",05/31/2018,Superman234,The podcast is very entertaining and very well produced with great content.,5
"Great podcast, fair reporting.",06/01/2018,dgaughan,Interesting subject matter. Fair and balanced reporting.,5
"Good content, hosts just ok",06/02/2018,Larispie,"I really enjoy hearing the in-depth reporting about a variety of topics.
I’m not thrilled with the delivery. Classic “NPR voice” from Kelly, meaning she wishes she was Ira Glass, so she affects his tics. A lot of the word “like”, which makes her sound less intelligent than I’m sure she is.",4
Season 1 was good,06/03/2018,Kc1985ks,Nothing worth listening to after season 1.,1
This show saves,05/09/2018,KngSean,This show saves me at work. Gets my mind out of the bubble that is the daily grind. Informs and educated but most importantly keeps it real. I love Kelly!,5
